0,1564412351,Mon Apr 20 03:22:06 PDT 2009,NO_QUERY,TerinAleah,Been up all night with Marissa throwing up! Ugh! 
0,1564412464,Mon Apr 20 03:22:08 PDT 2009,NO_QUERY,BrookeEstelle,"up for work, not at all well rested. "
0,1564412617,Mon Apr 20 03:22:12 PDT 2009,NO_QUERY,abigeeeze,hello monday. i miss my mom. 
0,1564412652,Mon Apr 20 03:22:12 PDT 2009,NO_QUERY,xStephTraff,ALOT of college work needs to get done today..  !
0,1564412825,Mon Apr 20 03:22:15 PDT 2009,NO_QUERY,DitteOlsen,@CrashBrazZz Because I'm three months too young to get the job I want. 
0,1564413226,Mon Apr 20 03:22:23 PDT 2009,NO_QUERY,JonasBrother_NJ,Happy that the new album is finally finished but I miss recording it 
0,1564413341,Mon Apr 20 03:22:24 PDT 2009,NO_QUERY,janineweaver,diet starts today  
0,1564413992,Mon Apr 20 03:22:37 PDT 2009,NO_QUERY,pearlbones,daddy gee is annoyed I never got him a top 
0,1564414013,Mon Apr 20 03:22:37 PDT 2009,NO_QUERY,nocturbulous,"My Mum had a minor stroke last week  I am worried for her, she has been my only family since I can remember. God bless you Tamilla."
0,1564414135,Mon Apr 20 03:22:40 PDT 2009,NO_QUERY,muttonchops,@pecche yep........... 
0,1564414283,Mon Apr 20 03:22:43 PDT 2009,NO_QUERY,Hattie237,packing 
0,1564414490,Mon Apr 20 03:22:46 PDT 2009,NO_QUERY,StinaCouture,woke up with a terrible tummy ache  getting ready for work...
0,1564414491,Mon Apr 20 03:22:47 PDT 2009,NO_QUERY,RobinTodd,Bummed this morning--pulled or strained muscle caused me to stop short at gym. 
0,1564414584,Mon Apr 20 03:22:48 PDT 2009,NO_QUERY,XxTiffanyxX,"Going Owt In A Bit Since Its Realii Sunny,,&amp; Try To Get A Tan (Not Gonna Happen,,Im Pale  ) lol!"
0,1564414629,Mon Apr 20 03:22:49 PDT 2009,NO_QUERY,marinelaface,wishing franklin the sausage dog didnt have to leave 
0,1564414963,Mon Apr 20 03:22:55 PDT 2009,NO_QUERY,Helly23,@risingpaulo theres no where id rather be on a day like today than sat in the office 
0,1564415228,Mon Apr 20 03:22:59 PDT 2009,NO_QUERY,kimberlycoleman,is wondering why every photo i upload is to big 
0,1564415241,Mon Apr 20 03:23:00 PDT 2009,NO_QUERY,tofucow,is doing her dissertation 
0,1564415666,Mon Apr 20 03:23:07 PDT 2009,NO_QUERY,countryvicar,"@LesleyCookman have ordered one of your books @ local bookshop, so eagerly awaiting. Sorry to learn that the first one is out of priint. "
0,1564415687,Mon Apr 20 03:23:08 PDT 2009,NO_QUERY,curlycooley,Can't find the George Lamb Show on twitter 
0,1564415927,Mon Apr 20 03:23:13 PDT 2009,NO_QUERY,solalonso,"@mileycyrus Don't be sad  Everything's okay, love you."
0,1564416045,Mon Apr 20 03:23:15 PDT 2009,NO_QUERY,va2042,"Im awake, but I dont want to be "
0,1564416260,Mon Apr 20 03:23:19 PDT 2009,NO_QUERY,Thehodge,"disapointed, had a really good idea for the @Spotify api  but it doesnt do what I want it to do "
0,1564416380,Mon Apr 20 03:23:21 PDT 2009,NO_QUERY,Taamziin,Ouch My Ear/Head Knee Toe Foot Arm And Finger Are Bleeding 
0,1564416714,Mon Apr 20 03:23:27 PDT 2009,NO_QUERY,becca_cooly,Awake and  in pain  bowling tonight ;)
0,1564416987,Mon Apr 20 03:23:32 PDT 2009,NO_QUERY,Lannako,"12:20. Online at school. My classmate is a creepy fucking stalker, I hate him "
0,1564416988,Mon Apr 20 03:23:32 PDT 2009,NO_QUERY,kfj,@nikkimurphy thanks! I feel yucky 
0,1564416992,Mon Apr 20 03:23:32 PDT 2009,NO_QUERY,Paul_Berney,"Throwing up all night, dammitt  Feeling good now though  How about those sucky soap awards? Nobody who deserves to win ever does "
0,1564417366,Mon Apr 20 03:23:39 PDT 2009,NO_QUERY,jumpahorse,is its rainy outside  so tired but has a full day ahead
0,1564417490,Mon Apr 20 03:23:42 PDT 2009,NO_QUERY,mmmikole,asjkd;adlsjf;alsjdk im poor  I need money.
0,1564417547,Mon Apr 20 03:23:43 PDT 2009,NO_QUERY,gns872,@ work 
0,1564417648,Mon Apr 20 03:23:45 PDT 2009,NO_QUERY,xpetfishnemox,Has run outta cereal  HUNGRRYYY!! :S
0,1564417694,Mon Apr 20 03:23:46 PDT 2009,NO_QUERY,KimHansford,@livi89 how bloody complicated is the activation of mast cells i drew the picture out and it took me forever!! getting back to it today 
0,1564417970,Mon Apr 20 03:23:50 PDT 2009,NO_QUERY,matthewjackson,"I can see the light... oh wait, that's the sun rising. "
0,1564418369,Mon Apr 20 03:23:58 PDT 2009,NO_QUERY,factmagazine,@abjekt she should've joined in the Do You Mind singalong at the end. 
0,1564418502,Mon Apr 20 03:24:00 PDT 2009,NO_QUERY,Raldski,@LiesThatBlind Lucky.  it's rainy here.
0,1564418816,Mon Apr 20 03:24:05 PDT 2009,NO_QUERY,dollyfi,"@Stefalicious  I can't believe it is just over, that conversation doesn't feel that long ago!"
0,1564418965,Mon Apr 20 03:24:08 PDT 2009,NO_QUERY,BekkiXD,German lesson is boring 
0,1564424497,Mon Apr 20 03:25:42 PDT 2009,NO_QUERY,jcafarley,"@campfireburning Yep, if we ever see any of that stuff in the UK "
0,1564424547,Mon Apr 20 03:25:43 PDT 2009,NO_QUERY,thep,"Me &amp; my friends used to ask ea other &quot;What club we hittin' tonight?&quot; Now, it's &quot;How's your cholesterol level?&quot; ..we're old "
0,1564424553,Mon Apr 20 03:25:43 PDT 2009,NO_QUERY,blckrosejm,Agh my stomach hurts 
0,1564424592,Mon Apr 20 03:25:43 PDT 2009,NO_QUERY,tsarnick,@Boddingtons yeah i know!! i'll be feeling it next Monday 
0,1564425048,Mon Apr 20 03:25:51 PDT 2009,NO_QUERY,yiuy,Back to work I go. Bye-bye glorious vacation!!! 
0,1564425250,Mon Apr 20 03:25:55 PDT 2009,NO_QUERY,BumblebeeDacker,the sun is shining and im stuck in work...not fun!! 
0,1564425346,Mon Apr 20 03:25:56 PDT 2009,NO_QUERY,rockinrenee64,@theshaungroves Me either M-F That is my alarm clock 
0,1564425424,Mon Apr 20 03:25:58 PDT 2009,NO_QUERY,nilegard,Arghh...hate merge conflicts! 
0,1564425947,Mon Apr 20 03:26:07 PDT 2009,NO_QUERY,bazzmatti,My day has just gone from 0 to shit in 10 seconds. Great  
0,1564425952,Mon Apr 20 03:26:07 PDT 2009,NO_QUERY,doc_nl,"@twitterfon just installed the 1.4.5 update, cleared the cache but the &quot;not following&quot; bug is still there "
0,1564426098,Mon Apr 20 03:26:09 PDT 2009,NO_QUERY,seo01,Lying on my back staring at the ceiling - have pulled a muscle 
0,1564426679,Mon Apr 20 03:26:19 PDT 2009,NO_QUERY,DaniGoode,Is Lovin The Weather Bu Cnt Believe I Av 2 Work  Lol
0,1564426696,Mon Apr 20 03:26:19 PDT 2009,NO_QUERY,curlydena,feeling super rubbish. writing a brochure on mobile document shredding is not helping  didn't even go out this weekend. there's no justice
0,1564427108,Mon Apr 20 03:26:26 PDT 2009,NO_QUERY,RocketMinx,"Lptop definatly dead. Get to start screen, click to log on and just crashes and restarts everytime  Not under guarentee either...fuck"
0,1564427987,Mon Apr 20 03:26:43 PDT 2009,NO_QUERY,tashais,How does this work ? 
0,1564428336,Mon Apr 20 03:26:48 PDT 2009,NO_QUERY,rosemari1,spring break is over  it's back to work
0,1564428619,Mon Apr 20 03:26:54 PDT 2009,NO_QUERY,xamylouise,whereareyou?  i miss you.
0,1564428760,Mon Apr 20 03:26:56 PDT 2009,NO_QUERY,juliaundchicco,@andreatunes I can't even come close to the update issue  Did you try it via the app itself?
0,1564428981,Mon Apr 20 03:27:00 PDT 2009,NO_QUERY,paulbeattie,iPod earbuds get so dirty 
0,1564429378,Mon Apr 20 03:27:05 PDT 2009,NO_QUERY,princeofny,"wat 2 do 2da, I think it supposed 2 rain  no good"
0,1564429434,Mon Apr 20 03:27:06 PDT 2009,NO_QUERY,Inyeni,Why is it so hard to get motivated to get out the door early when you need to the most.  All I want is to go back to bed.  
0,1564429538,Mon Apr 20 03:27:08 PDT 2009,NO_QUERY,retrobarbieDOLL,@TaliTresJolie lol aww man that sucks 
0,1564429539,Mon Apr 20 03:27:08 PDT 2009,NO_QUERY,darrenf,"@fistynuts depends on the terminals - some are joined, for those that aren't if you're staying airside it's just the bus I think. "
0,1564429811,Mon Apr 20 03:27:12 PDT 2009,NO_QUERY,spark2life,Working 7 to 7 today.Then Laura is coming over for 1/2 an hour.Wish I could spend more time with her. We're both just to busy right now. 
0,1564429915,Mon Apr 20 03:27:15 PDT 2009,NO_QUERY,sophia56,'s spring break is over and she has to go back to school! 
0,1564429958,Mon Apr 20 03:27:15 PDT 2009,NO_QUERY,Honey005, cant drive yet but that dont matter Im gonna learn bout cars and motorbikes.
0,1564429981,Mon Apr 20 03:27:15 PDT 2009,NO_QUERY,the_o,Very chuffed with my new Campers! But still sad to hear that they're leaving SA 
0,1564429986,Mon Apr 20 03:27:15 PDT 2009,NO_QUERY,faile88,Ah!  need sleep... my lack of sleep is starting to make me feel kinda sick 
0,1564430065,Mon Apr 20 03:27:17 PDT 2009,NO_QUERY,histapleface,"@ponyy nah, i think you better come kill them for me, they arn't here yet, i don't even know if they are coming baha i hope not !? "
0,1564430168,Mon Apr 20 03:27:18 PDT 2009,NO_QUERY,princeofny,"wat 2 do 2day, I think it supposed 2 rain  no good"
0,1564430234,Mon Apr 20 03:27:20 PDT 2009,NO_QUERY,Georgia321,"is doing her homework   ,back to school 2moz   "
0,1564430478,Mon Apr 20 03:27:23 PDT 2009,NO_QUERY,sammiebabesxo,"wih i was still on holiday, aaah "
0,1564430490,Mon Apr 20 03:27:24 PDT 2009,NO_QUERY,brewerbaby,@dedbim I agree. At least now he cant suffer anymore. 
0,1564430563,Mon Apr 20 03:27:25 PDT 2009,NO_QUERY,mxc4,i am too busy to eat and I am starving 
0,1564430868,Mon Apr 20 03:27:31 PDT 2009,NO_QUERY,maeveatkins,only 3 weeks left in london 
0,1564431011,Mon Apr 20 03:27:32 PDT 2009,NO_QUERY,lulu_bella76,"Gym/swim combo went surprisingly well today. Feeling energised &amp; alive. Certainly don't fancy sitting indoors working, but I must "
0,1564431022,Mon Apr 20 03:27:32 PDT 2009,NO_QUERY,VioletReaction,"awake too early, again.  stupid work."
0,1564431433,Mon Apr 20 03:27:40 PDT 2009,NO_QUERY,sidrajalil1132,@jasdeep no its to warm here 
0,1564431734,Mon Apr 20 03:27:44 PDT 2009,NO_QUERY,omgitsbia,says two days na akong may headache.  :'-(   http://plurk.com/p/p5e0o
0,1564431842,Mon Apr 20 03:27:47 PDT 2009,NO_QUERY,claireramsey,im in IT 
0,1564431969,Mon Apr 20 03:27:49 PDT 2009,NO_QUERY,vocd,"has hit her elbow on her laptop, who ever thought of calling it a funny bone, it's not "
0,1564432078,Mon Apr 20 03:27:51 PDT 2009,NO_QUERY,tomplaysguitar,"@maria250389 be grateful, I go back today "
0,1564432259,Mon Apr 20 03:27:54 PDT 2009,NO_QUERY,CadillacXlouis,Bored so ready to go home and my day just started. 
0,1564432647,Mon Apr 20 03:28:02 PDT 2009,NO_QUERY,deviant83,My knee is in tatters. Trust my office to be at the top of an uber steep flight of stairs 
0,1564432860,Mon Apr 20 03:28:05 PDT 2009,NO_QUERY,Luckywilson1,Back at work.....   
0,1564432893,Mon Apr 20 03:28:05 PDT 2009,NO_QUERY,countesslboogie,"Mornin ya'll! I overslept, and just barely made my flight. It was a good trip, though I didn't get to see some of my favorite people "
0,1564433217,Mon Apr 20 03:28:11 PDT 2009,NO_QUERY,Alli_Flowers,@Shmoe Oh noooooooooooooooooooooooooo! A week without #LOST is like....oh damn. 
0,1564433542,Mon Apr 20 03:28:16 PDT 2009,NO_QUERY,leannayo,tellmeee please 
0,1564433548,Mon Apr 20 03:28:16 PDT 2009,NO_QUERY,chiewmei,Yoga makes slouching painfulllll 
0,1564433718,Mon Apr 20 03:28:20 PDT 2009,NO_QUERY,boristhedalek,@mrtonylee Guess that means you're off then 
0,1564433724,Mon Apr 20 03:28:19 PDT 2009,NO_QUERY,ahyajriah,"ahya'ya is stopping at april 10th people!!! sorry folks, my hand hurt "
0,1564434120,Mon Apr 20 03:28:26 PDT 2009,NO_QUERY,NicoleJStephens,Ew 4/20 
0,1564434250,Mon Apr 20 03:28:29 PDT 2009,NO_QUERY,gooniesala,@Halo_Kitteh :[ ... i dont understand why it keeps happenin to me -i'm a good person i dont do much wrong by ppls. but i get tossed aside 
0,1564434287,Mon Apr 20 03:28:29 PDT 2009,NO_QUERY,DazzleMeThis,@shaundiviney wish I was there. Oh the woes of living on the opposite side of the country...  lol.
0,1564434324,Mon Apr 20 03:28:31 PDT 2009,NO_QUERY,Ed_Balmonte,I might have F***** up my only available contact with someone. 
0,1564434567,Mon Apr 20 03:28:36 PDT 2009,NO_QUERY,3nicola,Only an hour until I have to go to college  wouldnt mind but we wont even be doing much :|
0,1564434584,Mon Apr 20 03:28:35 PDT 2009,NO_QUERY,bgruby,going to school soon ...i dont really want to go 
0,1564434785,Mon Apr 20 03:28:38 PDT 2009,NO_QUERY,benheymink,@landrews2702 How very dare you.  It's true though - I'm in the wrong job! 
0,1564435058,Mon Apr 20 03:28:43 PDT 2009,NO_QUERY,Natty068,@simonrim oh no that's terrible  Are you still going to be able to do SFTW on Sunday though..
0,1564435194,Mon Apr 20 03:28:45 PDT 2009,NO_QUERY,beckstar1976,is watching missing pieces.. so heart breaking  makes you thankful for all you have..
0,1564435245,Mon Apr 20 03:28:47 PDT 2009,NO_QUERY,lkmlkm,no time for buying anything... i have alot of homework 
0,1564435470,Mon Apr 20 03:28:50 PDT 2009,NO_QUERY,cartoonmoney,"Egads, this train carriage smells like oranges, moisturizer and death. "
0,1564435598,Mon Apr 20 03:28:52 PDT 2009,NO_QUERY,andreatangg,@kiranerdcore dudee i have a horrible stomach ache too  this sucks
0,1564435716,Mon Apr 20 03:28:55 PDT 2009,NO_QUERY,joecore,@johnsens yea I know what you mean i have 1 day off extra then i have to go back to school 
0,1564435742,Mon Apr 20 03:28:56 PDT 2009,NO_QUERY,HannaUmar,is tired but have to do her geo presentation 
0,1564435815,Mon Apr 20 03:28:57 PDT 2009,NO_QUERY,Tomekad,About to do Tae Bo..hmm I wana jump back in the bed 
0,1564435921,Mon Apr 20 03:28:59 PDT 2009,NO_QUERY,Darce_Commander,"Been ill for a week now.....just cannot shift this cold, grr "
0,1564436502,Mon Apr 20 03:29:09 PDT 2009,NO_QUERY,cleaner,@soulsurrender wish i could help you with either the template or the headache 
0,1564436526,Mon Apr 20 03:29:09 PDT 2009,NO_QUERY,PDRPhotographer,@carrieholton well I am glad someone does  xxx
0,1564442497,Mon Apr 20 03:30:43 PDT 2009,NO_QUERY,Robbie_Letelier,Boredom at work 
0,1564442609,Mon Apr 20 03:30:46 PDT 2009,NO_QUERY,SeanDJ,"@circa1985circus Yes that isvery true. Sometimes I might get carried away, but it's an urgent matter. soft news Its Monday "
0,1564442741,Mon Apr 20 03:30:47 PDT 2009,NO_QUERY,Anna_A5,Workin... 
0,1564442949,Mon Apr 20 03:30:51 PDT 2009,NO_QUERY,DEC88,writing a paper...I cant focus 
0,1564443177,Mon Apr 20 03:30:55 PDT 2009,NO_QUERY,synnev,And now....Math....yay...not  hmm Can't wait to go to Paris! 
0,1564443573,Mon Apr 20 03:31:01 PDT 2009,NO_QUERY,retrobarbieDOLL,http://twitpic.com/3nehs - why they always hating on us short people? we need love too  even if he ain't real lmao
0,1564443696,Mon Apr 20 03:31:04 PDT 2009,NO_QUERY,Displacedmind,listening to pink floyd while drawing. i wish pete wasnt coming home late tonight 
0,1564443930,Mon Apr 20 03:31:07 PDT 2009,NO_QUERY,miss_r,"@amieewhitney Oh, but on the Telly, apart from VMA/EMA - I have EuroNews on in a kind of sad vain hope they might pop up lol "
0,1564444705,Mon Apr 20 03:31:20 PDT 2009,NO_QUERY,kevinisageek,Phone dying no net access 
0,1564444734,Mon Apr 20 03:31:20 PDT 2009,NO_QUERY,karifur,Dogs woke me up an hour ago and i can't get back to sleep. 
0,1564445021,Mon Apr 20 03:31:26 PDT 2009,NO_QUERY,StephaniePriest,I object to channel surfing &amp; finding full on sex scenes on 2 of the 4 channels we get in our home.I wish History Channel was free. 
0,1564445328,Mon Apr 20 03:31:30 PDT 2009,NO_QUERY,ABeautifulMind1,failed on Customer Focus! ironic as director in my last job told me he felt inferior due to all my cards/letters/flowers from the clients 
0,1564445556,Mon Apr 20 03:31:35 PDT 2009,NO_QUERY,emmy563,first schoolday after 2 weeks holiday... a bad day... 
0,1564445741,Mon Apr 20 03:31:38 PDT 2009,NO_QUERY,ClaireGUK,I hate having to do dissertations on such a beautiful day 
0,1564446087,Mon Apr 20 03:31:44 PDT 2009,NO_QUERY,ryanfredrickson,"i neeeeeeeeeddd more sleeep, i cant wait until summer so my lazy ass can sleep in "
0,1564446379,Mon Apr 20 03:31:49 PDT 2009,NO_QUERY,juju_be_juju,What?  what happned? Do you think youll be able to go to school?
0,1564446425,Mon Apr 20 03:31:50 PDT 2009,NO_QUERY,jannieautzen,@marieautzen Didnt get your up dates on fasion  genstart butikken igen igen igen)
0,1564446448,Mon Apr 20 03:31:52 PDT 2009,NO_QUERY,lubidoobidoo,says supposed to be tonight ang aming flight to thailand  http://plurk.com/p/p5eud
0,1564446468,Mon Apr 20 03:31:52 PDT 2009,NO_QUERY,McFly_Mad,@dougiemcfly I�m back at collage now  Be glad you�re not doing AS Biology! Are you going to be going near Darlington today (NorthEast?)
0,1564446527,Mon Apr 20 03:31:52 PDT 2009,NO_QUERY,CawleyE,@Gino_Jackman My wkend was ok i went for drinks fri night..Chilled out sat   Went for dinner last night wit friends! U do anythin crazy?
0,1564446619,Mon Apr 20 03:31:54 PDT 2009,NO_QUERY,Annoes,I need to make homework.. But i not in the mood for homework 
0,1564446642,Mon Apr 20 03:31:54 PDT 2009,NO_QUERY,jennifersalome,Fuck. I knew that if I went to bed before 1am that I would wake up at 3am. I've been trying to get back to sleep for 2 hours now. 
0,1564447048,Mon Apr 20 03:32:02 PDT 2009,NO_QUERY,Canahduhguy,@MariahCarey It was not what I was expecting 
0,1564447227,Mon Apr 20 03:32:05 PDT 2009,NO_QUERY,AnnekaBurrett,I am going to enjoy the sun...got no suncream so will defo be a lobster this evening 
0,1564447254,Mon Apr 20 03:32:04 PDT 2009,NO_QUERY,Kelley914,Walking to the bus stop. Its raining 
0,1564447656,Mon Apr 20 03:32:10 PDT 2009,NO_QUERY,yllan,@chumsdock Since we're not ready yet� 
0,1564447796,Mon Apr 20 03:32:13 PDT 2009,NO_QUERY,Julz341,taken kitty to the doc's... poor thing 
0,1564447797,Mon Apr 20 03:32:12 PDT 2009,NO_QUERY,MargaretJonas,I'm awake but I don't wanna be 
0,1564448108,Mon Apr 20 03:32:19 PDT 2009,NO_QUERY,RosieVie,Millie Mehari failed her CT this morning.  She's now at the car doctors waiting to get fixed. 
0,1564448291,Mon Apr 20 03:32:21 PDT 2009,NO_QUERY,Lulukidd,my leg really hurts 
0,1564448353,Mon Apr 20 03:32:23 PDT 2009,NO_QUERY,RallfGG,http://tinyurl.com/cat2hn so many apps for the I. Wanna get ridd of my HTC and move over to THE IPhone... still 26blablabla days to go 
0,1564448404,Mon Apr 20 03:32:24 PDT 2009,NO_QUERY,l0sst,And I'm still up 
0,1564448978,Mon Apr 20 03:32:34 PDT 2009,NO_QUERY,lizxx,@Chelle_xx I have to go back in there for my last lesson  
0,1564449124,Mon Apr 20 03:32:36 PDT 2009,NO_QUERY,mel3577,"@lauritax Heyyy, sorry I went to sleep. Any news, everything boring, and it's monday without House. "
0,1564449549,Mon Apr 20 03:32:45 PDT 2009,NO_QUERY,Benjamin_Leigh,"god this headache wont fuck off, im dying! little man with the jackhammer in my head, go away please "
0,1564449555,Mon Apr 20 03:32:45 PDT 2009,NO_QUERY,techbuzzd,"Finally, My site is back! I hope it will not be suspended again for UNKNOWN reasons.   http://tinyurl.com/c56gmw"
0,1564449593,Mon Apr 20 03:32:46 PDT 2009,NO_QUERY,McFly_Mad,@tommcfly Are you going to be going near Darlington today (NorthEast)? I�m back at collage now  Be glad you�re not doing AS Biology!
0,1564450106,Mon Apr 20 03:32:55 PDT 2009,NO_QUERY,MolzieMadness,doesn't want to go home 
0,1564450108,Mon Apr 20 03:32:54 PDT 2009,NO_QUERY,dicesix,"@saimin inside down to 15�C, outside up to 27�C. "
0,1564450125,Mon Apr 20 03:32:54 PDT 2009,NO_QUERY,lainiedavid,does not want to go to school. plus its cold outside 
0,1564450268,Mon Apr 20 03:32:57 PDT 2009,NO_QUERY,Papud,"So what to do, well im still sitting in my office chair, Im actualy doing something im twittering  and installing a server "
0,1564450382,Mon Apr 20 03:32:58 PDT 2009,NO_QUERY,GarethM,@SteveFalatko Aha yes a tenuous peg indeed. But it kind of works. Unless the producers take it out  Prepared to argue for it though!
0,1564451116,Mon Apr 20 03:33:10 PDT 2009,NO_QUERY,efacc,@robinec i realllllly wish i was! i couldn't get off today  i'll be watching like a maniac online though. so jeal you'll see in person!
0,1564451168,Mon Apr 20 03:33:11 PDT 2009,NO_QUERY,tashprice,Hates that her friends are in Egypt right now 
0,1564451233,Mon Apr 20 03:33:11 PDT 2009,NO_QUERY,jasongaunt,"@iambluecube Sorry Nath, would like to but I've got so much to catch up on  thanks for the offer though mate"
0,1564451410,Mon Apr 20 03:33:15 PDT 2009,NO_QUERY,ArpitaB,Am gonna really miss this place.. 
0,1564451793,Mon Apr 20 03:33:22 PDT 2009,NO_QUERY,manditex,Can't stop coughing 
0,1564452065,Mon Apr 20 03:33:26 PDT 2009,NO_QUERY,Liora_L,i have too much work to do 
0,1564452252,Mon Apr 20 03:33:30 PDT 2009,NO_QUERY,MadMuPPs,"@ryancarr92 yup, my first is 13th may. !! "
0,1564452405,Mon Apr 20 03:33:33 PDT 2009,NO_QUERY,LoraUnicorn,@Wavness I hate the new msn too.           (U)
0,1564452633,Mon Apr 20 03:33:37 PDT 2009,NO_QUERY,mangy20,feeling damn sleepy after a heavy lunch...also played 4 games of TT didn't quite helped 
0,1564452671,Mon Apr 20 03:33:38 PDT 2009,NO_QUERY,FirstClassBlank,I erased all of my previous Tweets and I don't know why 
0,1564452768,Mon Apr 20 03:33:40 PDT 2009,NO_QUERY,lilbabygirlloz,@MusicalProdigy yeah but its not doing anything 
0,1564452852,Mon Apr 20 03:33:41 PDT 2009,NO_QUERY,Amand4,is still feeling a bit confussed at how i use this twitter thing 
0,1564453014,Mon Apr 20 03:33:45 PDT 2009,NO_QUERY,tikibird,rarr flu is gone but has been replaced by a nasty headcold/sore throat. 
0,1564453262,Mon Apr 20 03:33:49 PDT 2009,NO_QUERY,zirconzelia,"OMG, just realized I have missed my locking dance class this afternoon!! "
0,1564453289,Mon Apr 20 03:33:50 PDT 2009,NO_QUERY,TeresaJimenez,Has a long week.....and really couldn't be any less upset that it's Monday already 
0,1564453367,Mon Apr 20 03:33:50 PDT 2009,NO_QUERY,alexperk,is in work  wish was out in sun riding my horse!!
0,1564453436,Mon Apr 20 03:33:52 PDT 2009,NO_QUERY,juju_be_juju,i do too  get better woman! is there anything you can take to stop it? like gingerale? erm...whatever medicine there is?!
0,1564453596,Mon Apr 20 03:33:54 PDT 2009,NO_QUERY,uberlou,@itsnodifferent i'm bored. I can't help it. 
0,1564453618,Mon Apr 20 03:33:54 PDT 2009,NO_QUERY,Cobalt_Fury,@stuntpilotx Oh no  Sinus owies are the effing worst
0,1564453691,Mon Apr 20 03:33:56 PDT 2009,NO_QUERY,Amand4,@fiona39kenton is still feeling a bit confussed at how i use this twitter thing 
0,1564453702,Mon Apr 20 03:33:55 PDT 2009,NO_QUERY,mobilesydney,I hate when it crazy rains  my car can't handle it lol
0,1564453913,Mon Apr 20 03:34:01 PDT 2009,NO_QUERY,ferretprincess,@fishgoat Extremely sad to hear that. Wish I could suggest something more helpful. 
0,1564454013,Mon Apr 20 03:34:02 PDT 2009,NO_QUERY,hmmc1991,@mileycyrus awwww miley its ok. I don't get to see my mom until june and the last I saw her was november.      be happy girlie
0,1564454110,Mon Apr 20 03:34:03 PDT 2009,NO_QUERY,legendaryalex,I hate Mondays 
0,1564460978,Mon Apr 20 03:36:00 PDT 2009,NO_QUERY,Clallen123,is stuck in work  
0,1564461316,Mon Apr 20 03:36:05 PDT 2009,NO_QUERY,thelemonadelady,Ugh... Back to the daily grind. Vacation is over  I'm gonna need moar coffee for this.
0,1564461811,Mon Apr 20 03:36:15 PDT 2009,NO_QUERY,ceejay_,has to clean her room for her party on thursday ): and doesnt have a costume for her own party. Needs help 
0,1564461928,Mon Apr 20 03:36:16 PDT 2009,NO_QUERY,theriz28,"@loveshockx3 Oh, Thanks. "
0,1564462240,Mon Apr 20 03:36:22 PDT 2009,NO_QUERY,stalkerh,"Can anyone here help me with getting some help on resolver one , sent email to company on Friday still no reply "
0,1564462671,Mon Apr 20 03:36:30 PDT 2009,NO_QUERY,jenryterry,Getting ready for work. 
0,1564462688,Mon Apr 20 03:36:31 PDT 2009,NO_QUERY,Freddieweddie,The high 5 has not worked today. 
0,1564462698,Mon Apr 20 03:36:30 PDT 2009,NO_QUERY,JessLovatt,I've Got Conjunctavitus 
0,1564462717,Mon Apr 20 03:36:31 PDT 2009,NO_QUERY,kirsty0990,Good Morning .... heading out for lunch today on my last day off before i go back to school tomorrow and then A Levels are 3weeks away 
0,1564462916,Mon Apr 20 03:36:35 PDT 2009,NO_QUERY,JasmineLaini,Awwwww  I wish Britney Spears would follow me on twiter  
0,1564462943,Mon Apr 20 03:36:36 PDT 2009,NO_QUERY,SashaPurr,"When floris left the balcony I tried to jump on the fence, the ladder against it fall, I panicked, almost falling 8 floors down. I meowed "
0,1564463278,Mon Apr 20 03:36:42 PDT 2009,NO_QUERY,kyelani,"umm... guys, would like 2 point out, lawn pic really IS a lawn, as in grass in the garden. been pointed out 2 me u may have misunderstood "
0,1564463286,Mon Apr 20 03:36:42 PDT 2009,NO_QUERY,PainterNik,"@Lybbe eh, it's still hurting a little, but I can walk up stair better. I miss running already. "
0,1564463310,Mon Apr 20 03:36:43 PDT 2009,NO_QUERY,maelstormthomas,"@danlarsen Damn I'm jealous, I spent a saturday waiting for wind  beam me up scotty http://bit.ly/kpoh9"
0,1564463593,Mon Apr 20 03:36:47 PDT 2009,NO_QUERY,freelanceknight,Even Medieval Knights have problems with iTunes. 
0,1564463717,Mon Apr 20 03:36:49 PDT 2009,NO_QUERY,mvpthomas,craves for an Angus Mushroom and Swiss XXL from Burger King 
0,1564463803,Mon Apr 20 03:36:51 PDT 2009,NO_QUERY,alishanaugler,"sick, possibly staying home from school once again.. "
0,1564463851,Mon Apr 20 03:36:52 PDT 2009,NO_QUERY,laurafleur,@oolamoola ooooooooh love them! Not my size either 
0,1564463868,Mon Apr 20 03:36:52 PDT 2009,NO_QUERY,cprasannas,@candy - this is Africa - we live in Africa 
0,1564463875,Mon Apr 20 03:36:51 PDT 2009,NO_QUERY,723,No sleep and I tried my hardest to sleep 
0,1564464002,Mon Apr 20 03:36:54 PDT 2009,NO_QUERY,wernshen,"@lokgotz i created a dupe to let my nipplelesshorse win. mana tau, my dupe dabao my main char.  btw, my dupe is called &quot;neneh&quot; hahahahha"
0,1564464065,Mon Apr 20 03:36:56 PDT 2009,NO_QUERY,ceejay_,has to clean her room for her party and still doesn't have a costume. Need help asap 
0,1564464313,Mon Apr 20 03:37:00 PDT 2009,NO_QUERY,soniaahlu,watching my favorite movie prince of egypt 
