0,1678126207,Sat May 02 05:36:14 PDT 2009,NO_QUERY,LapinKerchic,@Cerriduri It's dark in our pc room and it was night and had little lights  on etc. The rest of the pictures are a bit fuzzy  More soon!
0,1678126375,Sat May 02 05:36:17 PDT 2009,NO_QUERY,brado,@rosswitherby now all you need is a sore throat  get well soon buddy.
0,1678126524,Sat May 02 05:36:19 PDT 2009,NO_QUERY,itsdeadjim,"16 hour workday yesterday, and an even longer one today "
0,1678126725,Sat May 02 05:36:22 PDT 2009,NO_QUERY,kreezm,misses honey so much 
0,1678126873,Sat May 02 05:36:24 PDT 2009,NO_QUERY,xo_mcflyandjb,@zOuz_jb Shauns not atalking anoymore  you offended him
0,1678127284,Sat May 02 05:36:31 PDT 2009,NO_QUERY,jennybeanses,"awwwe, the doggies miss their parents.  They won't eat their food.  poor doggies."
0,1678127503,Sat May 02 05:36:34 PDT 2009,NO_QUERY,jwaltonscooter,@simplyshanon Make sure you give me instructions once you do. 
0,1678127579,Sat May 02 05:36:35 PDT 2009,NO_QUERY,somegirlsays,"@tuileries lol I know. So annoying people behave like that though, can really ruin things.  x"
0,1678127726,Sat May 02 05:36:37 PDT 2009,NO_QUERY,stellalowis,I miss someone badly 
0,1678127991,Sat May 02 05:36:41 PDT 2009,NO_QUERY,gr8rahul,@cacophonix5  cute creatures ...and good advertisment ... i just wished only their network was also good 
0,1678128093,Sat May 02 05:36:43 PDT 2009,NO_QUERY,knitpurlgurl,@Beadinbabe We had one (not built in) and the kidlets broke it.    I need 2 have 2 installed in my vehicle before our next long trip.
0,1678128335,Sat May 02 05:36:47 PDT 2009,NO_QUERY,editorescapist,Okay. WTH. I need it... STAY. Again. Me. STAY. 
0,1678128381,Sat May 02 05:36:47 PDT 2009,NO_QUERY,LesleyAnneJones,@ Just saw hannah Montanna Movie! So Awesome if a lil sad! I did cry 
0,1678128638,Sat May 02 05:36:51 PDT 2009,NO_QUERY,Jeffcs,Woke up with a headache so bad that it's painful to even look at the screen on my iPod Touch. 
0,1678128938,Sat May 02 05:36:56 PDT 2009,NO_QUERY,jacobleffler,seeing and hearing all the motorcycles out this morning.  Its killing me that mine is in the shop. 
0,1678129093,Sat May 02 05:36:58 PDT 2009,NO_QUERY,beabee,not feeling so good.. 
0,1678129237,Sat May 02 05:37:00 PDT 2009,NO_QUERY,CAn8iv,Argh!!!   Son's laptop won't boot. So glad I have a Mac. Computer repair is NOT what I had planned for today 
0,1678129254,Sat May 02 05:37:00 PDT 2009,NO_QUERY,DREKASMILES,"uup,tired as hell, trying to figure out if i should solve this matter with my friend....  "
0,1678129510,Sat May 02 05:37:04 PDT 2009,NO_QUERY,DeeDarling,@tryagain220 old RR just makes me lower my head and say a prayer after the eulogy 
0,1678129734,Sat May 02 05:37:07 PDT 2009,NO_QUERY,ekwisdom,@kc_74074 maybe you're right!!! Too bad she doesn't want to get her hair wet.  I told her I was willing to try some.
0,1678130300,Sat May 02 05:37:15 PDT 2009,NO_QUERY,twistedthursday,@berryfudge I'm not sure whether it'll be on ESPN or Star Sports. My cable TV provider don't have the rights to air the game. 
0,1678130449,Sat May 02 05:37:17 PDT 2009,NO_QUERY,icorr,@SeviDesigns I tried broken link 
0,1678130478,Sat May 02 05:37:17 PDT 2009,NO_QUERY,BrianTWalsh,oh need to tidy my shit pit of a room 
0,1678130788,Sat May 02 05:37:22 PDT 2009,NO_QUERY,sausheong,Been trying to look at iphone tutorial/guide but reading objective-c is giving me a headache 
0,1678130906,Sat May 02 05:37:24 PDT 2009,NO_QUERY,xxdeadxstarsxx,I'm so exhausted physically and mentally I'm not sure I can make it through the day. 
0,1678131340,Sat May 02 05:37:30 PDT 2009,NO_QUERY,ebrannco,working 9-2.. then more work after that  ...
0,1678131345,Sat May 02 05:37:31 PDT 2009,NO_QUERY,Rastabones,can't wait for the day when my bed has to kick me out of it.  Too bad it'll never happen 
0,1678131466,Sat May 02 05:37:32 PDT 2009,NO_QUERY,RCheesley,Watching the sunshine from inside - doing a migration today 
0,1678131498,Sat May 02 05:37:33 PDT 2009,NO_QUERY,Carolinacoral,W/all the local and natl hype about 'The Pit' ate thurs lunch was very dissapointed chopped que way too salty hush pups no flavor 
0,1678131715,Sat May 02 05:37:36 PDT 2009,NO_QUERY,asphotos,@figuromo i want cake 
0,1678131820,Sat May 02 05:37:38 PDT 2009,NO_QUERY,bmichalk,"@samreyes1216 i wish i was sittin on an A like you and Tasha  The second comprehensive is tough, I have to pass on going to POC today too "
0,1678132018,Sat May 02 05:37:40 PDT 2009,NO_QUERY,___lindsay,".........So Sick. Had to cancel my workout today , i feel to lousy  boooooo"
0,1678132140,Sat May 02 05:37:42 PDT 2009,NO_QUERY,snowhite197,"@greenslade1 'hehehe, you're really wierd.'  Lol!!!  Willy Wonka!  I had to google that though boo "
0,1678132167,Sat May 02 05:37:43 PDT 2009,NO_QUERY,msmercie,@cutthroat31  down wit the bulls! LOL
0,1678132272,Sat May 02 05:37:44 PDT 2009,NO_QUERY,ducban,"Just gave a poor old woman some money, feel sorry because it's the best I can. "
0,1678132378,Sat May 02 05:37:45 PDT 2009,NO_QUERY,nicolechen,oh man..... Singapore gonna die soon  cries.. this is exactly what is written in the bible.. lol... oppressions of christians!
0,1678140274,Sat May 02 05:39:44 PDT 2009,NO_QUERY,becsbez,Been talking to friends about travelling and taking me back to my days of wanting to live in NYC and travel the world 
0,1678140368,Sat May 02 05:39:46 PDT 2009,NO_QUERY,TiffWaller,slept in by 40 minutes. Darn body for thinking that I NEED to be up at 7 
0,1678140509,Sat May 02 05:39:48 PDT 2009,NO_QUERY,Shell_face,@chelkface RYAN FROM HIGHSCHOOL MUSICAL IS ALSO IN IT. Please go see it. I'd see it with you again but I can't this weekend  xox Much love
0,1678140811,Sat May 02 05:39:52 PDT 2009,NO_QUERY,FeDeRiCa92___,I WANT TO GO TO AMERICA!!!   
0,1678140835,Sat May 02 05:39:53 PDT 2009,NO_QUERY,stevekennedyuk,"Hangover from hell  drunk far too much red wine and suffering, though sat next to royalty which is some excuse, wouldn't let me twitpic"
0,1678141704,Sat May 02 05:40:04 PDT 2009,NO_QUERY,silentxcollapse,fuck the sun is rising.  I was so looking forward to sleep last night. What the hell man?
0,1678142000,Sat May 02 05:40:07 PDT 2009,NO_QUERY,clara018,@beasubido heck yeah!  I was like why?? :'(
0,1678142541,Sat May 02 05:40:14 PDT 2009,NO_QUERY,emzmwah,"KEEP FORGETTING MY PASSWORD, MR HOBBS THIS UPDATE IS FOR UR BENEFIT!! LOL  - PACKING UP GETTING READY TO LEAVE GLASGOW THIS WEEK - SAD "
0,1678142748,Sat May 02 05:40:16 PDT 2009,NO_QUERY,Kirsty_Matheson,An 8-year-old girl has won the right to divorce her 50-year-old husband... I should bloody well hope so! Poor girl 
0,1678142986,Sat May 02 05:40:19 PDT 2009,NO_QUERY,chisox4life,ahhhhhhhhhhhhhhhhhh my phone broke  suggestions for new one?
0,1678143081,Sat May 02 05:40:21 PDT 2009,NO_QUERY,utenamajor,Now its starting to rain and i'm only wearing a sweatshirt joy! 
0,1678143230,Sat May 02 05:40:23 PDT 2009,NO_QUERY,Cydster,This is the start of a very long long day with no naps. 
0,1678143297,Sat May 02 05:40:24 PDT 2009,NO_QUERY,Yuji_de_Sho_san,@blissfulsakura Hi my friend! Sorry I don't know him(it)  What kind of movie is it?
0,1678143329,Sat May 02 05:40:24 PDT 2009,NO_QUERY,markbowen,"@EvAngeli_ from what I can tell the wrong type and won't actually help at all, just giving false hope "
0,1678143461,Sat May 02 05:40:26 PDT 2009,NO_QUERY,Anne_A4L,"@nesquicus idk yet  i gotta wait till 10 or 11pm till my mum arrives in london,cuz she didnt call when she was on transit earlier  ugh!"
0,1678143576,Sat May 02 05:40:28 PDT 2009,NO_QUERY,Greenkermit,Does anybody know how I can see &quot; everyone&quot; ?It seems they changed the format and have to do a search now....  
0,1678143695,Sat May 02 05:40:29 PDT 2009,NO_QUERY,starlite75,tweetdeck is acting up  booo!! lol
0,1678144157,Sat May 02 05:40:36 PDT 2009,NO_QUERY,_bethan,i just stubbed my toe on a chair  AND it was the pinkie! thats the best toe!
0,1678144191,Sat May 02 05:40:36 PDT 2009,NO_QUERY,PharaohKatt,No one is coming to Rock Band 
0,1678144307,Sat May 02 05:40:38 PDT 2009,NO_QUERY,RichardBlais,"Another day of cooking shows. KBIS , Atlanta. 3 sets today. It's my wives b day and we are in different cities "
0,1678144504,Sat May 02 05:40:41 PDT 2009,NO_QUERY,dumbbadoor,@Addiiee FFUUU I'm an Elf now! I really don't want to be a hobbit.  I want to be with @leggy_legolas. No offense to @realbaggins- ily tho.
0,1678144828,Sat May 02 05:40:46 PDT 2009,NO_QUERY,teejay0109,@Jayme1988 yeah im ok...I did the blog to get out of my system but it looks horrible 
0,1678144878,Sat May 02 05:40:47 PDT 2009,NO_QUERY,jchcrawk,"Too much work to do as far as moving, had to skip Men's Breakfast this morning "
0,1678145338,Sat May 02 05:40:54 PDT 2009,NO_QUERY,sanjive01,@MaiAbaza Tell me abt it! I have a trip coming up too! 
0,1678145435,Sat May 02 05:40:55 PDT 2009,NO_QUERY,Padlew318,Stuffed now  just had a pint and steak in the redwell. Could have done with more but is driving 
0,1678145455,Sat May 02 05:40:55 PDT 2009,NO_QUERY,0hashh,i HATE wrking on saturdays 
0,1678145698,Sat May 02 05:40:59 PDT 2009,NO_QUERY,nappy_steph,@twistedraisin *hugs*  the end of trips are so anticlimatic
0,1678146424,Sat May 02 05:41:09 PDT 2009,NO_QUERY,CraigVenables,cant belive this is my last ever post on twitter  i love you all in my own special way xxxxxxxxxxxxxxxxxxxxxxxxxxxxxxxxxxxxxxxxxxxxxxxxxxx
0,1678146526,Sat May 02 05:41:10 PDT 2009,NO_QUERY,twilightsunset,i meant sob srry haley that ur sick 
0,1678146576,Sat May 02 05:41:11 PDT 2009,NO_QUERY,StephenDMason,@mrsmetaphor I hear it's gonna do this all day. 
0,1678146594,Sat May 02 05:41:11 PDT 2009,NO_QUERY,andheartsarah,my tummy is saying RAWR but i don't wanna roll outta bed 
0,1678147015,Sat May 02 05:41:17 PDT 2009,NO_QUERY,mrs_doc,Realizes this was a far bigger mistake than i estimated   
0,1678147429,Sat May 02 05:41:22 PDT 2009,NO_QUERY,Yisel_Cullen,Waking up� I didn�t sleep well 
0,1678147474,Sat May 02 05:41:23 PDT 2009,NO_QUERY,c_lightning,Is FUCK how many more times is this gonna happen tired of this going to bed late and waking up early 
0,1678147523,Sat May 02 05:41:24 PDT 2009,NO_QUERY,chur6,@minithommo game 7 @ 10am tomorrow morning on one hd cant wait. bet you miss home now 
0,1678147641,Sat May 02 05:41:26 PDT 2009,NO_QUERY,JessiyBotelho,the door says we are not open yet. The gates are still up but no let push on the door anyways. Ahg morning 
0,1678148015,Sat May 02 05:41:31 PDT 2009,NO_QUERY,rob_hillfield,suffering from travel vaccs and listening to delicate sounds of tree pulping... 
0,1678148037,Sat May 02 05:41:32 PDT 2009,NO_QUERY,jodiekearns,"Alec Wilder's songs are so beautiful, they make me cry. Blackberry Winter was myself and Craig's favourite song to do together "
0,1678148193,Sat May 02 05:41:34 PDT 2009,NO_QUERY,RainbowSoulPoet,hey @MrzNikki u have seriously been incognegro 
0,1678148235,Sat May 02 05:41:35 PDT 2009,NO_QUERY,laserOCK,can hear Ross playing Resi 5 which makes me sad cos im revising 
0,1678148949,Sat May 02 05:41:46 PDT 2009,NO_QUERY,JagmarKytten,@CBSNews thats horrible 
0,1678149497,Sat May 02 05:41:54 PDT 2009,NO_QUERY,Xx_Janine_xX,is on her way back to Colchester  but is unfortunately stuck in lots of traffic 
0,1678149543,Sat May 02 05:41:54 PDT 2009,NO_QUERY,StephBraganza,is wondering what the hell happened to everyone last night?? 
0,1678149555,Sat May 02 05:41:55 PDT 2009,NO_QUERY,LLL1ND4,What a boring saturday night 
0,1678149580,Sat May 02 05:41:55 PDT 2009,NO_QUERY,etherealxosoul,Woke up with a really bad stomach ache.  now I'm just sitting up in bed..wishing I could lay down w/out being in pain.
0,1678149892,Sat May 02 05:41:59 PDT 2009,NO_QUERY,clarisseee,@Laurenandhearts I'm sorry lauren for kakingyou feel bad 
0,1678149948,Sat May 02 05:42:00 PDT 2009,NO_QUERY,netheadz,Okay Tigers..... time to snap out of this MULTI-RUN inning for the opponent funk - okay?  This is starting to get a bit old.  
0,1678150080,Sat May 02 05:42:02 PDT 2009,NO_QUERY,tashie_16,is terrfified...and doesnt know wat to do 
0,1678150165,Sat May 02 05:42:02 PDT 2009,NO_QUERY,milliejudd,Thinking how sad about Danny Gans. Prayers to his family. 
0,1678150441,Sat May 02 05:42:06 PDT 2009,NO_QUERY,Amzieebbz,still no 22nd follower 
0,1678151215,Sat May 02 05:42:16 PDT 2009,NO_QUERY,RachelMcFly,@taylormcfly They are  I wanna goooo
0,1678151398,Sat May 02 05:42:19 PDT 2009,NO_QUERY,cndflybaby,@DianeDenmark btw did you get clips put together for #TMMM? I never ended up getting a copy of the movie 
0,1678151511,Sat May 02 05:42:21 PDT 2009,NO_QUERY,amel_melli,what i'm gonna do??.. doing my THESIS 
0,1678151725,Sat May 02 05:42:24 PDT 2009,NO_QUERY,aissuperbodoh,oh my . badmood right now 
0,1678151879,Sat May 02 05:42:26 PDT 2009,NO_QUERY,geocachingbot,Just back from #geocaching the caches I failed at last time... got one... failed again on the other  (via @ribzlike) http://bit.ly/bfXD1
0,1678151999,Sat May 02 05:42:28 PDT 2009,NO_QUERY,cinsyn66,"@MikeTheGuy  I am so bummed!  I won a key on 95SX, but my work schedule changed and now I can't go...   Oh well, there's next year! :"
0,1678152334,Sat May 02 05:42:33 PDT 2009,NO_QUERY,gd0t,why am i up so early on a Saturday? 
0,1678152447,Sat May 02 05:42:34 PDT 2009,NO_QUERY,Anchhh,"Trying to do eyebrow thing, that those cabury kids seem to be rocking... I can't seem to Mexican wave them though..... bummer "
0,1678152481,Sat May 02 05:42:35 PDT 2009,NO_QUERY,nadszy,"having my 'girl' time, its so hard to be a GIRL "
0,1678152518,Sat May 02 05:42:35 PDT 2009,NO_QUERY,Azza77,@Sheald ok i know u said u hd to work on friday but working whilst you're sick...at home trying to recover...that's just not cricket!! 
0,1678152863,Sat May 02 05:42:40 PDT 2009,NO_QUERY,AWFRox,"feeling really dizzy, just nearly fainted :| ... i hope it isnt swine flu  so ill"
0,1678152913,Sat May 02 05:42:41 PDT 2009,NO_QUERY,thesalopian,is waiting to go to work... 10pm-4:30am 
0,1678152986,Sat May 02 05:42:42 PDT 2009,NO_QUERY,samanthablews,@TheTreelo  i might be on a bit tomorrow. but mum's going overseas for ten days so i won't have regular access till the 14th :'( sorry!!
0,1678153115,Sat May 02 05:42:44 PDT 2009,NO_QUERY,jozzaness,i'm hoping ang praying that i'll past the qualifying exam..  sana tlga.............
0,1678153330,Sat May 02 05:42:47 PDT 2009,NO_QUERY,NicciHale,@fionagmr &quot;in gaga&quot; dont you mean &quot;to gaga&quot; oh well..club [v] !! my brothers at an 18th and im stuck at home 
0,1678160144,Sat May 02 05:44:26 PDT 2009,NO_QUERY,artsangel,Looks like I'll be spending my entire public holiday painting commissions for University marketing materials. Foo. I wanted to code 
0,1678160464,Sat May 02 05:44:30 PDT 2009,NO_QUERY,apeeee,@laaaaurenn holy crap Lauren that sucks 
0,1678160513,Sat May 02 05:44:31 PDT 2009,NO_QUERY,nielsbruin,Doing a pit-stop at q8. 30 min till arival @jeroenhoman place. Nasty flies covering my car  http://twitpic.com/4ee7c
0,1678161004,Sat May 02 05:44:38 PDT 2009,NO_QUERY,nicolechen,God please forgive all that oppress you....   sigh...
0,1678161253,Sat May 02 05:44:41 PDT 2009,NO_QUERY,DySaRt_1,NOW TO REVISE FOR MY LAST EXAMS AT UNI 
0,1678161584,Sat May 02 05:44:46 PDT 2009,NO_QUERY,bill_archie,dinner cancelled!cousin surprise us with a visit.ugh.mood not good 
0,1678161953,Sat May 02 05:44:51 PDT 2009,NO_QUERY,Ericanderson09,Laser tag in a bit. Then snug harbor prom tonight. Last snug harbor party for the class of 09 
0,1678162004,Sat May 02 05:44:51 PDT 2009,NO_QUERY,aussie_ali,@Jintanut that's a good idea - will do. thanks babes. hopefully it's not too far away. this numb stage sucks 
0,1678162598,Sat May 02 05:45:00 PDT 2009,NO_QUERY,chok11,"went grocery shopping, and got home and nobody's home, i am home alone! "
0,1678163113,Sat May 02 05:45:05 PDT 2009,NO_QUERY,TadRocks48,hating the fact that i started a damn twitter  
0,1678163280,Sat May 02 05:45:07 PDT 2009,NO_QUERY,kbensleyx,its my 18th brithday and my poor mother is devastatedd  lol
0,1678163286,Sat May 02 05:45:07 PDT 2009,NO_QUERY,Mister_Spears,"Kevin is ugly, stupid, fat &amp; he destroyed Brit'. "
0,1678163705,Sat May 02 05:45:12 PDT 2009,NO_QUERY,UnholyStar,"@born2c0de haha I had the same idea, I couldn't bring myself to blow up megaton "
0,1678163778,Sat May 02 05:45:13 PDT 2009,NO_QUERY,siglove,is afraid to go CORPORATE  *college* http://plurk.com/p/rdiym
0,1678164376,Sat May 02 05:45:21 PDT 2009,NO_QUERY,lexikitty,@jaydems oh really? hmm i see. but your red is so niiiiiiiiiice! -mourns- 
0,1678164541,Sat May 02 05:45:23 PDT 2009,NO_QUERY,marchingme,wants to eaaaaaattttttt  http://plurk.com/p/rdizr
0,1678164573,Sat May 02 05:45:23 PDT 2009,NO_QUERY,Sarah_Hearts_U,Up early on Saturday  off to work... Bring on the sunshine!!!!!!!
0,1678164584,Sat May 02 05:45:24 PDT 2009,NO_QUERY,Mister_Spears,"@Simon_GaGa Kevin is ugly, stupid, fat &amp; he destroyed Brit'. "
0,1678164958,Sat May 02 05:45:29 PDT 2009,NO_QUERY,dannicrosby,beach today. my boy leaves tomorrow 
0,1678165094,Sat May 02 05:45:31 PDT 2009,NO_QUERY,DEBRAFAY,working too hard on a Saturday  Gonna' check out a minor league BB game 2-nite so that will B alright-there will be fireworls-aahh..
0,1678165126,Sat May 02 05:45:31 PDT 2009,NO_QUERY,samanthablews,@TheTreelo HAHAHAHAHAHA. YES! YES YES YES. ok done now. umm... i'm sorry    i miiiight be getting a new charger for my laptop though
0,1678165434,Sat May 02 05:45:35 PDT 2009,NO_QUERY,BiGVixXen,Crap! Now I'm starting to get tired! 
0,1678165988,Sat May 02 05:45:43 PDT 2009,NO_QUERY,Nakimusic7,@Samantha_2008 why are u in pain? are you sick? 
0,1678166011,Sat May 02 05:45:44 PDT 2009,NO_QUERY,el7omed,@BiGVixXen :S I asked to play with u in COD but u didn't reply 
0,1678166155,Sat May 02 05:45:46 PDT 2009,NO_QUERY,skinnyangel18,"Dallas is warm, but no sun!!  "
0,1678166257,Sat May 02 05:45:47 PDT 2009,NO_QUERY,SisterSadist,@ChristieB13 it's a great day for some chillaxin... My happy ass has to go to school and finish labs though 
0,1678166586,Sat May 02 05:45:51 PDT 2009,NO_QUERY,beckiwithani,@cbethblog Sorry it was such a bad night! 
0,1678166590,Sat May 02 05:45:51 PDT 2009,NO_QUERY,SannyDamet,@kevin_vincent I won't be coming tonight  Talk to the band about playing acoustic on June 19th &amp; let me know what's up
0,1678166600,Sat May 02 05:45:52 PDT 2009,NO_QUERY,aussie_ali,"@MrW0nderful glad to hear you're all well-pls pass along my love. thanks hun-a lot of ppl don't get it, but she was a part of my family "
0,1678166820,Sat May 02 05:45:55 PDT 2009,NO_QUERY,samanthablews,@TheTreelo so if i do i'll be on. but idk what's happening there 
0,1678166842,Sat May 02 05:45:55 PDT 2009,NO_QUERY,staceyy__x,8 weeks till malia! im so scared that i wont be able to afford it  fucking bank of scotland :@
0,1678167469,Sat May 02 05:46:03 PDT 2009,NO_QUERY,DonniezDetDiva,Hey V  just here to c ddub has yet to announce vid winner 
0,1678167745,Sat May 02 05:46:07 PDT 2009,NO_QUERY,sophiepandora,depressed today... I miss my doggy 
0,1678168604,Sat May 02 05:46:19 PDT 2009,NO_QUERY,keija,"WHO DOES WORK ON THE RAIL TRACKS ON A BANK HOLIDAY?!?! It's a 2hr extended journey to begin with, now we're being &quot;held&quot; &amp; Shout!'s at 3! "
0,1678168651,Sat May 02 05:46:20 PDT 2009,NO_QUERY,surrenderresist,@30SECONDSTOMARS i'm thinking about how much my bf might hate me...  and how i'm going to live without him. i have my own war... 
0,1678168775,Sat May 02 05:46:22 PDT 2009,NO_QUERY,CompDad,@peterwolff  So where was that Low Acidic coffee you indicated might have been available..  You arrive and then shot through 
0,1678168826,Sat May 02 05:46:23 PDT 2009,NO_QUERY,ruthifer,So much for catching up on sleep and sleeping in today 
0,1678169185,Sat May 02 05:46:28 PDT 2009,NO_QUERY,XaosQueen,HMMMM Okay Techno Nerd Boy is SERIOUSLY Ticking Me Off.  No wonder he's getting a divorce.  His actions are seriously BiPolar 
0,1678169604,Sat May 02 05:46:33 PDT 2009,NO_QUERY,nadszy,"@KimilovesJB it starts here like never, i never see the trailer like on youtube, and  i reallly want to watch Sonny With A Chance too "
0,1678170136,Sat May 02 05:46:41 PDT 2009,NO_QUERY,AndreaLiew,@FayeFayeChang CMA prep course 
0,1678170163,Sat May 02 05:46:41 PDT 2009,NO_QUERY,Reillywtfff,I should be at @thebamboozle today 
0,1678170193,Sat May 02 05:46:42 PDT 2009,NO_QUERY,GirltaristHan,@carole29 cool. I go back Tuesday  kinda fed up of where I work.
0,1678170380,Sat May 02 05:46:44 PDT 2009,NO_QUERY,GotchaMichel,Still missing to watch persija @ gbk 
0,1678170460,Sat May 02 05:46:45 PDT 2009,NO_QUERY,kristay54,eh. grandparents house. reading a supah cool book right now............ probably an update from my phone later. bad day already. 
0,1678170887,Sat May 02 05:46:51 PDT 2009,NO_QUERY,RoeBloodBathx,Boylet already went home.  BUT WE HAD FUN! 
0,1678170964,Sat May 02 05:46:52 PDT 2009,NO_QUERY,szferi,installing Zimbra. I guess 100 times in this year 
0,1678171045,Sat May 02 05:46:53 PDT 2009,NO_QUERY,chelseamac11,"gting rdddy, then piercing at ottawaaa! ... no soccer. again "
0,1678171841,Sat May 02 05:47:04 PDT 2009,NO_QUERY,XJonasGomezX,@D0odii i didn't draw the skecth 
0,1678172055,Sat May 02 05:47:07 PDT 2009,NO_QUERY,pamblundell,"kids playing with water pistols in the garden. S is winning. Jobs done, house full of food. I think time for some knitting, or maybe work "
0,1678172142,Sat May 02 05:47:08 PDT 2009,NO_QUERY,purple_dog,so unwell today  waiting for the mum to vacate the building... didnt know what vacate meant tbh
0,1678172496,Sat May 02 05:47:13 PDT 2009,NO_QUERY,Grenouillebleue, baby died last night. @$%%$# day.
0,1678172777,Sat May 02 05:47:18 PDT 2009,NO_QUERY,Banana_Split,@boniiita whaaat. in wismayakin? I d0nt have transp0rt 2 go there! Sorray  i'm actually @ Marilyn's n0w lol
0,1678173012,Sat May 02 05:47:21 PDT 2009,NO_QUERY,xthismodernlove,Hate saturdays at work. Always eat too much junk.  we have multipack doritos and cookies and biscuits and starbucks so far. Fattie.
0,1678173032,Sat May 02 05:47:22 PDT 2009,NO_QUERY,xthismodernlove,Hate saturdays at work. Always eat too much junk.  we have multipack doritos and cookies and biscuits and starbucks so far. Fattie.
0,1678173141,Sat May 02 05:47:23 PDT 2009,NO_QUERY,prempanicker,@bigfatphoenix : haven't checked mail. Hyoeractive day 
0,1678173311,Sat May 02 05:47:26 PDT 2009,NO_QUERY,EmAeSgTs,"sad shes missing the crab cook off in Ocean City, MD.  First of many events I will miss.  "
0,1678173411,Sat May 02 05:47:27 PDT 2009,NO_QUERY,jaisonlee,I just can't get a good night sleep in a hotel anymore. 
0,1678173430,Sat May 02 05:47:27 PDT 2009,NO_QUERY,GraceBurns,today is a walk around the mall day but dont buy anything cuz i dont have any money. i cant do that thought ive got work 
0,1678173621,Sat May 02 05:47:30 PDT 2009,NO_QUERY,brinnlene,@nagalimanila you're working tomorrow? 
0,1678173904,Sat May 02 05:47:34 PDT 2009,NO_QUERY,Vain_Fame,@DaSkateBoardKiD I know... 
0,1678174032,Sat May 02 05:47:36 PDT 2009,NO_QUERY,Rebookar,"@MarkkB aww dude  thats rather crap, write like a full on letter, to the apple head, and try and claim your money back?"
0,1678174145,Sat May 02 05:47:37 PDT 2009,NO_QUERY,Thrashnet,Awake  and getting some more contacts on myspace.
0,1678174369,Sat May 02 05:47:40 PDT 2009,NO_QUERY,heavsunshines,@Gemified o I hope you were not refering to yesterday  sorry dude
0,1678174419,Sat May 02 05:47:41 PDT 2009,NO_QUERY,HCHanning,Epic BBQ-evening yesterday - unfortunately the mandatory headache kicked in with a vengence today 
0,1678174657,Sat May 02 05:47:44 PDT 2009,NO_QUERY,l1oydish,Bike was way too painful    And now i have horrible throbbing pain that wont go away!!!!
0,1678174786,Sat May 02 05:47:46 PDT 2009,NO_QUERY,moanyoldgit,Is sitting in traffic a23 into Brighton 
0,1678175224,Sat May 02 05:47:52 PDT 2009,NO_QUERY,FunkyDung,is going to freeze his balls off during the marathon tomorrow. 
0,1678182330,Sat May 02 05:49:30 PDT 2009,NO_QUERY,Bedatri,"@samitbasu i feel so guilty now.you shall have no powercuts till july,i guess "
0,1678182386,Sat May 02 05:49:31 PDT 2009,NO_QUERY,SJB666,"@meggytron I'm good, thanks. Yeah my twitter-timing is way off somehow - I keep missing you   &lt;3"
0,1678182482,Sat May 02 05:49:32 PDT 2009,NO_QUERY,Hotspur_1882,"@RedAntiques just caught that story, same thing that sparked berba leavng  though really cant see him at ManU unless Ronaldo does go"
0,1678182924,Sat May 02 05:49:38 PDT 2009,NO_QUERY,JayCB,"Wish they hadn't made Deadpool like that in Xmen Origins. Deadpools awesome, so whyyyy "
0,1678182938,Sat May 02 05:49:39 PDT 2009,NO_QUERY,Elaineos,I'm so scared the Ireland date is gone from the tour section of Team Jonas!!!!!!! AHHH! I hope it hasn't been cancelled!!!!! 
0,1678182991,Sat May 02 05:49:39 PDT 2009,NO_QUERY,Karma89,"Hmmmm, bored  wat shud I do? Any suggestions??"
0,1678183263,Sat May 02 05:49:44 PDT 2009,NO_QUERY,sopheerose,hmmm midnight youth were just on juice. 
0,1678183393,Sat May 02 05:49:46 PDT 2009,NO_QUERY,valengina,"I'm up early, I wish I was going to bamboozle! "
0,1678183784,Sat May 02 05:49:50 PDT 2009,NO_QUERY,rollingstones12,Trying to get in some soccer practice before it rains. 
0,1678184088,Sat May 02 05:49:55 PDT 2009,NO_QUERY,aircaterpillar,"Just had my teeth checked, now my eyes. I'm dying for a coffee but can't drink for an hour. "
0,1678184438,Sat May 02 05:50:01 PDT 2009,NO_QUERY,ChrisHobson,@brionyqueen awful lol! Its sorta lost its curl and afro-ness 
0,1678184873,Sat May 02 05:50:05 PDT 2009,NO_QUERY,Tinkerbell47,"Cookin breakfast over campfire this morning--eggs, potatoes and STEAK! Dghtr &amp;grdson will join us--last day w/them. Head 4Ohio 2morrow "
0,1678184958,Sat May 02 05:50:06 PDT 2009,NO_QUERY,TDz,@SaberSaturn I've read that article in paper version. not quite impressed 
