0,1564563453,Mon Apr 20 04:03:32 PDT 2009,NO_QUERY,Hollywood_Trey,If anybody remembers how Eddie embarrassed Dave Chappelle on &quot;Nutty Prof.&quot; Well Jamie Foxx does 2 some1 in real life   http://bit.ly/9S3fe
0,1564563531,Mon Apr 20 04:03:34 PDT 2009,NO_QUERY,TayMcfaggy,is hoping and praying that some how the school burnt down to a pile of ashes and I don't have to go.  its not going to happen ayee.
0,1564563548,Mon Apr 20 04:03:34 PDT 2009,NO_QUERY,dnsnow,good afternoon - today's too nice to work in a basement 
0,1564563780,Mon Apr 20 04:03:39 PDT 2009,NO_QUERY,farhan,started up twitteriffic on OSX Desktop.. now it won't die!!  silly app 
0,1564564562,Mon Apr 20 04:03:51 PDT 2009,NO_QUERY,FIREBOXXX,I don't want to go back to school today. 
0,1564564956,Mon Apr 20 04:03:57 PDT 2009,NO_QUERY,TakaComics,Pissed that the &quot;Top 5 Movies&quot; thing on Facebook doesn't have &quot;Spring And Chaos&quot;. Grrr...Awesome anime movie that nobody knows about! 
0,1564564957,Mon Apr 20 04:03:57 PDT 2009,NO_QUERY,gabutterfly84,"I think im getting sick, my throat is starting to itch. "
0,1564565146,Mon Apr 20 04:04:00 PDT 2009,NO_QUERY,sammiebabesxo,English next  fml
0,1564565165,Mon Apr 20 04:04:00 PDT 2009,NO_QUERY,mirelled,is as sick as a dog 
0,1564565249,Mon Apr 20 04:04:01 PDT 2009,NO_QUERY,aprillawton,getting ready for the grindstone. 
0,1564565306,Mon Apr 20 04:04:03 PDT 2009,NO_QUERY,jethrocarr,"uhoh....loo has blocked up so it drains slowly... hope it just fixes itself, do not want to have to sort out a plumber tomorrow... "
0,1564565370,Mon Apr 20 04:04:03 PDT 2009,NO_QUERY,blackieboo123,good morning. first class at 8 :15  im sad.
0,1564565425,Mon Apr 20 04:04:04 PDT 2009,NO_QUERY,Jesssicamw,"Hurt my ankle really bad playing soccer. Haha, I laugh the pain off, but it still hurts worse than a sprain "
0,1564565466,Mon Apr 20 04:04:04 PDT 2009,NO_QUERY,htpaws,is looking at the lovely sunshine outside 
0,1564565680,Mon Apr 20 04:04:07 PDT 2009,NO_QUERY,ZefanyaDeby,"oh no, i think i just got fever. i really dont feel well. "
0,1564565710,Mon Apr 20 04:04:08 PDT 2009,NO_QUERY,ItchyFingaz,paperwork     I need a minion for this.
0,1564566073,Mon Apr 20 04:04:13 PDT 2009,NO_QUERY,peweedesign,Hermanzeniiiiito had some strange link on his msn and I looked at it... Now I want to go to columbia for vacation 
0,1564574456,Mon Apr 20 04:06:21 PDT 2009,NO_QUERY,stephp0,@KIMMAAY what language?! LOL i can't figure it out 
0,1564574523,Mon Apr 20 04:06:23 PDT 2009,NO_QUERY,shaileelathe,"@fartingpen ah, The AC ain't working here! apparently a battery blew up! *rolls eyes* so now the genrator is on and no AC "
0,1564574579,Mon Apr 20 04:06:24 PDT 2009,NO_QUERY,defunct1,"@wasabifreak Nah, had the salmon ramen. Rubbish for $5, never again "
0,1564574675,Mon Apr 20 04:06:25 PDT 2009,NO_QUERY,lovely113z,I forgot to fill my water bottle when I made my breakfast.  I don't want to have to go back in there and run into the coffee freaks again 
0,1564574754,Mon Apr 20 04:06:27 PDT 2009,NO_QUERY,oXLoVeXo94,came right now back from school.... was soooo boring today... 
0,1564574772,Mon Apr 20 04:06:27 PDT 2009,NO_QUERY,daisy_andrew,byby bilg here we come! yay!!  hahahaha
0,1564575171,Mon Apr 20 04:06:33 PDT 2009,NO_QUERY,lukechin,@lettersincolour work issues... when people arent trained they cant be expected to perform 
0,1564575210,Mon Apr 20 04:06:34 PDT 2009,NO_QUERY,mellykitten,i need more ice but it's all run out 
0,1564575651,Mon Apr 20 04:06:41 PDT 2009,NO_QUERY,vikshah,@Wossy GaGa was hard work wasn't she?! How disappointing to see she's more f'ed up than Jacko  Did she seem more human off-camera?
0,1564575893,Mon Apr 20 04:06:45 PDT 2009,NO_QUERY,misssarahb,slept when she got home and now must do homework at 4am.  
0,1564576337,Mon Apr 20 04:06:52 PDT 2009,NO_QUERY,CtrlF5,@smashingmag link http://tinyurl.com/dnfng3  has fatal error 
0,1564576531,Mon Apr 20 04:06:55 PDT 2009,NO_QUERY,ash_CT,Damn. I accidentally threw a rooibos teabag into my cup. 
0,1564576721,Mon Apr 20 04:06:57 PDT 2009,NO_QUERY,Evemma,Needs a money tree!! 
0,1564576738,Mon Apr 20 04:06:58 PDT 2009,NO_QUERY,jlhabitan,I accidentally cancelled my mom's Flixter account but I thought I cancelled mine. Turns out...it's not. 
0,1564577013,Mon Apr 20 04:07:01 PDT 2009,NO_QUERY,x0Adriannaaa,"As boring as my spring break was, i wish i still had another week of it just because i DON'T want to go to school! "
0,1564577085,Mon Apr 20 04:07:03 PDT 2009,NO_QUERY,Rage88,Back at work. 
0,1564577266,Mon Apr 20 04:07:05 PDT 2009,NO_QUERY,fuzzy76,"Crap, my 13+ year old email address just got closed. "
0,1564577412,Mon Apr 20 04:07:08 PDT 2009,NO_QUERY,carousella,I have lost the ability to work with music playing in the background. Epic fail. 
0,1564577418,Mon Apr 20 04:07:08 PDT 2009,NO_QUERY,volleyball32010,I don't think I'm ready for this 
0,1564577689,Mon Apr 20 04:07:13 PDT 2009,NO_QUERY,xVivicax,"Shit, looks like my internet's going to be cut off soon because I missed a bill. Fucks sake. I hate being poor "
0,1564577949,Mon Apr 20 04:07:17 PDT 2009,NO_QUERY,charleeee_b,sick of aall of this shit happening  needs helpful advicee .. GOIN TO BEYONCE YAY. GOOD CHARLOTTEE WILL STILL TOP IT :p &lt;3333
0,1564577951,Mon Apr 20 04:07:16 PDT 2009,NO_QUERY,megananne3,not ready for Monday! 
0,1564578229,Mon Apr 20 04:07:21 PDT 2009,NO_QUERY,kiimmmmyy,Flint bound 
0,1564578363,Mon Apr 20 04:07:23 PDT 2009,NO_QUERY,xoryro,Twitter isnt sending to my phone 
0,1564578377,Mon Apr 20 04:07:24 PDT 2009,NO_QUERY,FuchsiaStiletto,@Stulittle Working as per usual - not fun and its sunny outside  A day of Twittering I think. You going to classes?
0,1564578861,Mon Apr 20 04:07:31 PDT 2009,NO_QUERY,hernameisnicki,@FiFiTheFAIRY i wish i could but i think it will be too late to get good tickets now and i know one would go wiv  xx
0,1564579041,Mon Apr 20 04:07:34 PDT 2009,NO_QUERY,kynndalwyoming,Wretched weather. alexs note washed off my car 
0,1564579127,Mon Apr 20 04:07:35 PDT 2009,NO_QUERY,NiteShok,@jmdonellan Checking our yr blog. Text on the sides is WAY hard to read on a dark background 
0,1564579498,Mon Apr 20 04:07:40 PDT 2009,NO_QUERY,LoicPearl,Ok so I have class on my birthday also have a fitting for a friend and its supposed to rain can forget have to sketch all on the big 21 
0,1564579589,Mon Apr 20 04:07:41 PDT 2009,NO_QUERY,johannschwella,I find Plesk massively confusing. 
0,1564579677,Mon Apr 20 04:07:43 PDT 2009,NO_QUERY,gelzie,just had her first full meal in the IBM canteen and didn't like it..  http://plurk.com/p/p5mbi
0,1564580283,Mon Apr 20 04:07:52 PDT 2009,NO_QUERY,Humperdude,happy 420.. wish I was in Florida  
0,1564580346,Mon Apr 20 04:07:53 PDT 2009,NO_QUERY,PaoloZaffino,On the train on my way to work! Its so early 
0,1564580613,Mon Apr 20 04:07:58 PDT 2009,NO_QUERY,scumm_boy,"Had a fantastic weekend, which will make today suck that much more "
0,1564580683,Mon Apr 20 04:08:00 PDT 2009,NO_QUERY,justyboy,man.. they r sending those poor piratebay creators to jail!! Booo to them!! blow to P2P 
0,1564580771,Mon Apr 20 04:08:00 PDT 2009,NO_QUERY,jbmoongirl,Rainy monday...perfect day to stay in bed...too bad I got to go to work. 
0,1564580886,Mon Apr 20 04:08:02 PDT 2009,NO_QUERY,thebishopoftwit,"@architectmark sure is! What not 1 bit of kit? Mask, Fins and suit surely! BSAC got us to pay up and look big!   I Still go snorkeling."
0,1564581235,Mon Apr 20 04:08:07 PDT 2009,NO_QUERY,deafpower,@curliehair69 what happened to your camera ? 
0,1564581582,Mon Apr 20 04:08:12 PDT 2009,NO_QUERY,BreakDancingAmy,im da only girlly girl on!! woohoo!! wait... guyz don't bully meh  bye bye queen!
0,1564581806,Mon Apr 20 04:08:16 PDT 2009,NO_QUERY,rakaur,@ejacqui Tweetie doesn't scroll to the top 
0,1564581870,Mon Apr 20 04:08:17 PDT 2009,NO_QUERY,Mark_Milly,@royalt_rapqueen -lol I aint even get that... 
0,1564581930,Mon Apr 20 04:08:18 PDT 2009,NO_QUERY,MartGray,Been to the gym but it must have been Mute Day � no one admired my manly form 
0,1564582211,Mon Apr 20 04:08:23 PDT 2009,NO_QUERY,cittiecait,@martinhiggins although i should have done maths to a-level i think  i should be ok though
0,1564582228,Mon Apr 20 04:08:23 PDT 2009,NO_QUERY,xjudder,First day back at work  and it's very tedious waiting for a data conversion to go through
0,1564582291,Mon Apr 20 04:08:23 PDT 2009,NO_QUERY,gerrymoth,"Out a drive in the countryside stuck behind a tractor pulling a trailer full of manure, oh the joy! "
0,1564582507,Mon Apr 20 04:08:27 PDT 2009,NO_QUERY,La_Camille,Typical. The weather's lovely and i'm stuck in school 
0,1564582607,Mon Apr 20 04:08:28 PDT 2009,NO_QUERY,richardBarley,@ownedbyacat Just back to england for the week to work sadly 
0,1564582667,Mon Apr 20 04:08:29 PDT 2009,NO_QUERY,dunksaredead,On my way to work.. 
0,1564582890,Mon Apr 20 04:08:33 PDT 2009,NO_QUERY,Abatashi,Tired and bored... All my friends aren't in contact with me  and nothing to do at home...
0,1564583168,Mon Apr 20 04:08:37 PDT 2009,NO_QUERY,boxdog,"@atebits sites.fastspring.com is taking its sweet time to do this transaction.  Is it my internets, or is it their payment g/way?"
0,1564583190,Mon Apr 20 04:08:38 PDT 2009,NO_QUERY,doober,Time to read legal docs 
0,1564583350,Mon Apr 20 04:08:39 PDT 2009,NO_QUERY,mandinator,back to work 
0,1564583468,Mon Apr 20 04:08:41 PDT 2009,NO_QUERY,chan_atl,Talk about well rested :-D the only downfall is I can hear the rain POURING 
0,1564583621,Mon Apr 20 04:08:44 PDT 2009,NO_QUERY,soulflowering,Raining. POURING. and im driving to frederick. 
0,1564583622,Mon Apr 20 04:08:43 PDT 2009,NO_QUERY,grahamdenny,"Back to work today after a week off, and it's a baptism of fire. What a morning... "
0,1564583907,Mon Apr 20 04:08:48 PDT 2009,NO_QUERY,BulchyC,All this suncream makes it look like someones jizzed on my face 
0,1564584272,Mon Apr 20 04:08:55 PDT 2009,NO_QUERY,tiffanymarie_x3,not so nice weather out 
0,1564584478,Mon Apr 20 04:08:58 PDT 2009,NO_QUERY,ledavisdang,Omg I rly am the only student on school. This is so awkward and creepy. 
0,1564584592,Mon Apr 20 04:09:00 PDT 2009,NO_QUERY,natanicole,Finishing the literature mid-term  tomorow still have exams &gt;&quot;&lt;
0,1564584762,Mon Apr 20 04:09:01 PDT 2009,NO_QUERY,Johenius,"All I want is to go home, buy bread &amp; milk, and jam some L4D. What I *have* to do is get this stupid project finished "
0,1564585401,Mon Apr 20 04:09:11 PDT 2009,NO_QUERY,Jessumz,My wriist is damn sore 
0,1564585618,Mon Apr 20 04:09:14 PDT 2009,NO_QUERY,SeeTheSunInMe,"Hmm , .. the singing practise was canceled today  . But i got home earlier !  . Also , gonna get a bad bad grade on the math test..:/"
0,1564586130,Mon Apr 20 04:09:22 PDT 2009,NO_QUERY,lunadiviner,"@Ja5c0 i know right  but it will. its been out for ages though, asians introduced it to me last yr"
0,1564594293,Mon Apr 20 04:11:27 PDT 2009,NO_QUERY,derrickhenslee,"@Bwilkins hey, I'm really sorry to hear about your grandpa. That's a horrible loss. "
0,1564594427,Mon Apr 20 04:11:28 PDT 2009,NO_QUERY,PrincessLeanneG,is loving the sunshine shame i have to go back to work  x
0,1564594582,Mon Apr 20 04:11:31 PDT 2009,NO_QUERY,musicalmover,I want @vidaecaffe 
0,1564594682,Mon Apr 20 04:11:33 PDT 2009,NO_QUERY,RandaMarie,Can't get back to sleep 
0,1564594777,Mon Apr 20 04:11:34 PDT 2009,NO_QUERY,renward,@veronamay I'm actually more AAW than BLOOD over it atm. Masuka! Aaaw. 
0,1564594825,Mon Apr 20 04:11:35 PDT 2009,NO_QUERY,pipsqueakkkk,I'm way too tired. And i'm wheezing. 
0,1564595081,Mon Apr 20 04:11:39 PDT 2009,NO_QUERY,klavehicle,Everyone is tweeting links and fun stuff but I get to wait until I get home to cliiiiiick! 
0,1564595150,Mon Apr 20 04:11:40 PDT 2009,NO_QUERY,sortingtrolley,q's th effectiveness of his flu shot as a flu-like symptoms persist 
0,1564595307,Mon Apr 20 04:11:43 PDT 2009,NO_QUERY,big_blue_wolf,@JCTurner It is on my touch but been lazy and haven't opened it recently. Wifey gets pissed off when I'm surfing all the time. 
0,1564595343,Mon Apr 20 04:11:43 PDT 2009,NO_QUERY,ttaasshhaa,@ameym21 I know I have no idea. 
0,1564595361,Mon Apr 20 04:11:44 PDT 2009,NO_QUERY,spoofscript,@aido thats really not a bad idea! I'd do the same if I had a mac laptop 
0,1564595659,Mon Apr 20 04:11:48 PDT 2009,NO_QUERY,Imjoan,"@tsuibb No la! Sigh, I made some careless mistakes  I guess the outcome may not be that good... xx"
0,1564595660,Mon Apr 20 04:11:49 PDT 2009,NO_QUERY,cl4irethomas,What a lovely day!!  Shame I'm stuck in the office 
0,1564595877,Mon Apr 20 04:11:52 PDT 2009,NO_QUERY,revolutionaren,@hhertzof  *more cuddles*
0,1564596146,Mon Apr 20 04:11:56 PDT 2009,NO_QUERY,UVAHooGirl,"running SUPER late b/c my stomach's upset... and its raining, so this drive is really gonna suck major ass "
0,1564596410,Mon Apr 20 04:12:01 PDT 2009,NO_QUERY,manu94,"back aftr anothr gruellin day of classes  time to rlax yippee,by d way that slumdog grl  is actually frm a slum u knw.same fr the boys too"
0,1564596556,Mon Apr 20 04:12:03 PDT 2009,NO_QUERY,pisces_star16,Why must school be so early? 
0,1564596874,Mon Apr 20 04:12:07 PDT 2009,NO_QUERY,stormduck,I'm bored to death in class and the internet is refusing to provide entertainment 
0,1564596876,Mon Apr 20 04:12:08 PDT 2009,NO_QUERY,bigsexybuffie, spring break is over not sur who's more disappointed me or da kid.  *Buffie*
0,1564596976,Mon Apr 20 04:12:08 PDT 2009,NO_QUERY,ABZQuine,"@Hey_Bawheed wish it was, I only had  a wee scoof "
0,1564597104,Mon Apr 20 04:12:11 PDT 2009,NO_QUERY,msmoss,@bopeepsheep Poor lovie. One of the things I'm seein me dr about thisavvy is my episotomy scar 
0,1564597289,Mon Apr 20 04:12:13 PDT 2009,NO_QUERY,brettinghams,"my brother is in barcelona, i am here in berlin. he made the best coffee  (rbs)"
0,1564597511,Mon Apr 20 04:12:16 PDT 2009,NO_QUERY,TremendousTiff,Okay.. I lied. NOW I am 
0,1564597517,Mon Apr 20 04:12:17 PDT 2009,NO_QUERY,Lfcmonkey,Off to work and it's doin good weather outside.............. oh what joy. catch ya laters 
0,1564597543,Mon Apr 20 04:12:16 PDT 2009,NO_QUERY,cloemccloclo,lying in bed with a  rather uncomfortable leg... about to take some disgusting painkillers and attempt to get up to the toilet 
0,1564597676,Mon Apr 20 04:12:19 PDT 2009,NO_QUERY,Liziegirl,UGH MONDAY 
0,1564597765,Mon Apr 20 04:12:20 PDT 2009,NO_QUERY,wiickedgiirl,getting ready for school...but i dont want to go 
0,1564598010,Mon Apr 20 04:12:23 PDT 2009,NO_QUERY,wbgookin,1 kid staying home with pinkeye + 1 kid staying home because we can't go to coop preschool + a rainy day = a very long day for me.  
0,1564598142,Mon Apr 20 04:12:26 PDT 2009,NO_QUERY,kayla_fame,Still sad this morning 
0,1564598519,Mon Apr 20 04:12:31 PDT 2009,NO_QUERY,chroniclesofdee,"Will it rain again? I hope it does otherwise, I am pretty sure, I would self-combust.. "
0,1564598867,Mon Apr 20 04:12:36 PDT 2009,NO_QUERY,misslyndsy,"Breaking out the first skirt of the season. Would have worn my springy white pants, but I'm pretty sure they no longer fit "
0,1564598904,Mon Apr 20 04:12:38 PDT 2009,NO_QUERY,cyxob,@MarisRelins nav v?rts. t?l?t z/s vairs neeksist?s. visi b?s sia 
0,1564598962,Mon Apr 20 04:12:39 PDT 2009,NO_QUERY,owenleelife,It turns out that Tweetie-without-ads is NOT free 
0,1564599004,Mon Apr 20 04:12:39 PDT 2009,NO_QUERY,punkypoet,is just hoping she'll make it through today and tonight. it's just gonna be so hard 
0,1564599095,Mon Apr 20 04:12:40 PDT 2009,NO_QUERY,missgingergirl,shane left his toothbrush..how can something so simple make me cry so much. damn hormones. I miss my shane-e-pot-pie 
0,1564599104,Mon Apr 20 04:12:41 PDT 2009,NO_QUERY,CharKearney,@garethjsmith http://twitpic.com/3nfbn - i really don't know them 
0,1564599327,Mon Apr 20 04:12:44 PDT 2009,NO_QUERY,SUBSONIX,@burntfilm Why you haz no macbook? 
0,1564599330,Mon Apr 20 04:12:45 PDT 2009,NO_QUERY,Raaawry,Its like the Fail Whale is stalking me 
0,1564599360,Mon Apr 20 04:12:44 PDT 2009,NO_QUERY,naggip,its sunny for the first time EVER and i have to stay in and write an essay about Frankestein  BUMMER
0,1564599383,Mon Apr 20 04:12:45 PDT 2009,NO_QUERY,Flowdeeps,Jack's back to the vets tonight 
0,1564599455,Mon Apr 20 04:12:46 PDT 2009,NO_QUERY,danibaby,@intencitiess me too  finals suck.
0,1564599519,Mon Apr 20 04:12:48 PDT 2009,NO_QUERY,stephp0,@KIMMAAY ohhhh i'm so dumb  i've gone through every language :'(
0,1564599578,Mon Apr 20 04:12:48 PDT 2009,NO_QUERY,jaykotak,nicest day of the year so far? ... it really is revision / exam time 
0,1564599711,Mon Apr 20 04:12:50 PDT 2009,NO_QUERY,fishcake22,back to school 
0,1564599919,Mon Apr 20 04:12:54 PDT 2009,NO_QUERY,StefaanLesage,"@Bunker Bah, can't seem to find a link to the download on the atebits site "
0,1564599963,Mon Apr 20 04:12:53 PDT 2009,NO_QUERY,SLVO,Twitter could be ruined   http://bit.ly/psZVD
0,1564600100,Mon Apr 20 04:12:56 PDT 2009,NO_QUERY,AnaKatey,@mileycyrus why? What did you have going on? I'm sorry your day was bad  take off tomorrow!
0,1564600144,Mon Apr 20 04:12:56 PDT 2009,NO_QUERY,vonIrrwegen,"1pm. Finally in Amsterdam! Monday national Dutch traffic jam day, eek  Now @ work. Have a nice day!"
0,1564600241,Mon Apr 20 04:12:56 PDT 2009,NO_QUERY,Gem_28,"OMG has just smashed my tall mirror, how many years bad luck is that???? does anyone know.  "
0,1564600247,Mon Apr 20 04:12:58 PDT 2009,NO_QUERY,TereseBergman,twitter + cellphone = will not effing work! 
0,1564600263,Mon Apr 20 04:12:58 PDT 2009,NO_QUERY,dj_bubble,just reached home... tired 
0,1564600296,Mon Apr 20 04:12:59 PDT 2009,NO_QUERY,TotalMK,"Had a great weekend, got to see MM9 tear up the Northan at Byron, got real drunk...stayed in luxury, but now am back in Melbourne. "
0,1564600356,Mon Apr 20 04:13:00 PDT 2009,NO_QUERY,SirCrumpet,#Tweetie #Help @atebits_support Is there a shortcut key to &quot;Post&quot; the Tweet from the compose box? Enter doesn't work 
0,1564600571,Mon Apr 20 04:13:03 PDT 2009,NO_QUERY,stephhxx,Ughh. It's wayy to early.  Getting my stuff together then off to brockton high. Laterr.
0,1564601145,Mon Apr 20 04:13:10 PDT 2009,NO_QUERY,FireRocEnt,too fucking early 
0,1564601188,Mon Apr 20 04:13:12 PDT 2009,NO_QUERY,stackielynn,@soundlyawake i love youuuu! haha oh yes bbq was good but getting drunk on a sunday was bad news bears.. work all day today 
0,1564601226,Mon Apr 20 04:13:12 PDT 2009,NO_QUERY,lordsbread,Ughh.. School  Good morning everyone.. Worst classes today dammit! See you all at 4:00 and 35 more days of school yeah!
0,1564601231,Mon Apr 20 04:13:13 PDT 2009,NO_QUERY,christinajcee,there is nothing to do these days  xx
0,1564601356,Mon Apr 20 04:13:14 PDT 2009,NO_QUERY,sugarghc,i don�t know what i�ll do later 
0,1564601723,Mon Apr 20 04:13:20 PDT 2009,NO_QUERY,christina4isaac,"I need a sponsor to pay my race entry fees, I just can't keep up with these.  I want to enter more races but not enough $ for the fees."
0,1564601750,Mon Apr 20 04:13:20 PDT 2009,NO_QUERY,Courtney79,"first morning in 2 weeks that I have woke up sick. I thought I was over the hump, but I guess not "
0,1564601937,Mon Apr 20 04:13:24 PDT 2009,NO_QUERY,melbell101,morningggggg; tired  [getting ready for school]
0,1564602011,Mon Apr 20 04:13:24 PDT 2009,NO_QUERY,Baggatoast,"Woot, no breakfast again. "
0,1564602253,Mon Apr 20 04:13:28 PDT 2009,NO_QUERY,Ponytailz,why is it raining? Noooooooooo! suppose to rain today and tomorrow. all freakin day too. I might have to cancel that hair appointment. 
0,1564602364,Mon Apr 20 04:13:30 PDT 2009,NO_QUERY,105Ross,"Waking up, drinking coffee, and checking out Harper's Globe.  Man am I addicted.  Raining outside.  Yucky day.  Want to go running.Can't. "
0,1564602488,Mon Apr 20 04:13:32 PDT 2009,NO_QUERY,shhshannon,@wastethisnight  awe it's okay. and i'm leaving early! lol how fantastic. is colleen coming?
0,1564602516,Mon Apr 20 04:13:32 PDT 2009,NO_QUERY,vinay_s,@achitnis is that really gonna help the it sector here?..i doubt not 
0,1564602533,Mon Apr 20 04:13:33 PDT 2009,NO_QUERY,themil,@mostlylisa @darkmotion mostlylisa.com 
0,1564602816,Mon Apr 20 04:13:37 PDT 2009,NO_QUERY,sassy8girl,says got my insurance for my laptop because my charger is broke.   back at college nearly finished though j... http://plurk.com/p/p5nkv
0,1564602916,Mon Apr 20 04:13:38 PDT 2009,NO_QUERY,SouthTxSun,Good morning twitters! How come our weekdays go so slow but weekends go so fast 
0,1564603161,Mon Apr 20 04:13:42 PDT 2009,NO_QUERY,gulddina,@emsli is a LIAAAAAAAAAAAAR!! I thought we were friends  !!
0,1564603221,Mon Apr 20 04:13:43 PDT 2009,NO_QUERY,kencat500,"Getting off to work, again, "
0,1564603537,Mon Apr 20 04:13:47 PDT 2009,NO_QUERY,Sunnysky7,The future lingers uncertain for my son.    One step at a time.
0,1564603553,Mon Apr 20 04:13:48 PDT 2009,NO_QUERY,Ingeri,School. Lunch. Mall. STUDY. i have a loooong night ahead of me  Again.. Physics is POOP.
0,1564603617,Mon Apr 20 04:13:49 PDT 2009,NO_QUERY,tom_howarth,"@jpiscaer grrrr,   stuck in the office now "
0,1564603666,Mon Apr 20 04:13:50 PDT 2009,NO_QUERY,DorothyMcQ,The getting out of bed thing doesnot sound like a good idea 
0,1564604024,Mon Apr 20 04:13:55 PDT 2009,NO_QUERY,717coco,@sew4the8r Breukelen fire alarm is messed up.  obnoxious fire drills.
0,1564605197,Mon Apr 20 04:14:12 PDT 2009,NO_QUERY,apt,First #Tweetie bug for me... cant add another account get an authentication error 
0,1564615211,Mon Apr 20 04:16:40 PDT 2009,NO_QUERY,rufeelinme,Is tired 
0,1564615910,Mon Apr 20 04:16:50 PDT 2009,NO_QUERY,MaryTheFairy,@tiannanosyke i agree 
0,1564616187,Mon Apr 20 04:16:55 PDT 2009,NO_QUERY,julianerose,is going to her last day with her first grade class.  so sad.
0,1564616243,Mon Apr 20 04:16:56 PDT 2009,NO_QUERY,xLacerationx,my whole body hurts  I hate being unfit hahaha
0,1564616412,Mon Apr 20 04:16:59 PDT 2009,NO_QUERY,Archeia,OMG I CAN'T USE TWEETDECK!!!  T_T
0,1564616505,Mon Apr 20 04:16:59 PDT 2009,NO_QUERY,KassieG,Hello twitterland!! I feel like friggin crap today 
0,1564616958,Mon Apr 20 04:17:06 PDT 2009,NO_QUERY,thesaraghina,"Rainy, icky Monday morning.  So wasn't ready to get out of bed this morning."
0,1564616961,Mon Apr 20 04:17:07 PDT 2009,NO_QUERY,ZoeST,lovely sunny day 2day! got to pay for my car tax 2moro 
0,1564617308,Mon Apr 20 04:17:12 PDT 2009,NO_QUERY,emilyrendall,"Is awake, uni times, bad times "
0,1564617457,Mon Apr 20 04:17:14 PDT 2009,NO_QUERY,AussieJBlover89,I wanna wake up feeling beautiful today &amp; tomorrow &amp; everyday! I'm sick of feeling &amp; looking like shit   
0,1564617506,Mon Apr 20 04:17:15 PDT 2009,NO_QUERY,patttyjonas,off to a slow boring day of school 
0,1564617541,Mon Apr 20 04:17:15 PDT 2009,NO_QUERY,Zachreh,Where are you at d-man?!?!? Working 
0,1564617590,Mon Apr 20 04:17:16 PDT 2009,NO_QUERY,p5ym0n,"Is loving the sun, shame I have to go back to work "
0,1564617782,Mon Apr 20 04:17:17 PDT 2009,NO_QUERY,xoryro,saaaad face 
0,1564617785,Mon Apr 20 04:17:18 PDT 2009,NO_QUERY,normaltusker,it's been freaking long since i last read a good book. a trip to the bookstore is due but dunno if i can go this weekend! 
0,1564617790,Mon Apr 20 04:17:17 PDT 2009,NO_QUERY,SaraKilis,Like shattered glass...  tomorrow = school  NOOOO! 
0,1564617841,Mon Apr 20 04:17:18 PDT 2009,NO_QUERY,BabyKitten98,"Ahh, just took a dumb shower  I don't wanna go to school  have to write a dumb paper and taks is next week ;_;"
0,1564618024,Mon Apr 20 04:17:21 PDT 2009,NO_QUERY,dportela,is not good at all at saying goodbye to people he loves. Especially when it's most likely goodbye forever. 
0,1564618097,Mon Apr 20 04:17:23 PDT 2009,NO_QUERY,jstout813,Not having a car makes you realize just how much freedom it affords you. Get better soon car 
0,1564618143,Mon Apr 20 04:17:23 PDT 2009,NO_QUERY,JBAddict13,@selenagomez oh girl.at first i followed the wrong sel  now i am following youu.the real awesome.you're my idol.i love youu so much.?
0,1564618271,Mon Apr 20 04:17:24 PDT 2009,NO_QUERY,DropDeadEmilyy,At school  damn how can I have seen two of the bitches I hate at the same fucking time
0,1564618284,Mon Apr 20 04:17:25 PDT 2009,NO_QUERY,blackfonzie,"@IWCharters This week actually will be kind of rough, b/c two managers are out on vacation &amp; I'm covering for both of them simultaneously "
0,1564618358,Mon Apr 20 04:17:26 PDT 2009,NO_QUERY,miatastic,"I miss the old days. I wish things were back to normal, before all this mess happened.  Sorry, TK."
0,1564618361,Mon Apr 20 04:17:26 PDT 2009,NO_QUERY,Dlick,"Morning, sun is shining but not as warm as it did in Egypt..back in sweden "
0,1564618482,Mon Apr 20 04:17:28 PDT 2009,NO_QUERY,xoubliettex,Holy god. Giving up smoking was the worst idea ever. First time I've been serious about it. I think I'm gonna cry again haha. Urgh. 
0,1564618654,Mon Apr 20 04:17:30 PDT 2009,NO_QUERY,SArmy_Snowglobe,I am wishing I didn't live so far away from all the action 
0,1564618817,Mon Apr 20 04:17:33 PDT 2009,NO_QUERY,neil_garb,@denouncer your rss feed doesn't have the whole post 
0,1564619370,Mon Apr 20 04:17:41 PDT 2009,NO_QUERY,mytbadblonde,has too much compassion to do nothing for Bernie while he is sick. And my poor Ryguy is not so hot either. 
0,1564619516,Mon Apr 20 04:17:43 PDT 2009,NO_QUERY,PhrankTheBoxMan,I can't Tweet from school anymore  If I don't want to get in trouble)...I'll have to wait until 4:30 - 5:00 until my next Tweet! Good Bye!
0,1564619532,Mon Apr 20 04:17:43 PDT 2009,NO_QUERY,anonomi,All moving back in now.  still don't know whats happened. Its also lunch time!
0,1564619725,Mon Apr 20 04:17:46 PDT 2009,NO_QUERY,BurntCaramel,And now.. BACK TO ATHENS! Gosh.. I really need some sleep.. Ps; ginetai ths poytanas apo kinhsh sthn a8hnwn-lamias 
0,1564619753,Mon Apr 20 04:17:47 PDT 2009,NO_QUERY,icequeenpam,is up and getting ready to go - no coffee for me 
