0,1677921271,Sat May 02 04:41:04 PDT 2009,NO_QUERY,mmbopidy,i have the hangover from hell  i think i'm going to die
0,1677921472,Sat May 02 04:41:08 PDT 2009,NO_QUERY,betthan,cant be bothered to write this essay...especially while knowing there is football on 
0,1677921475,Sat May 02 04:41:08 PDT 2009,NO_QUERY,AwesomeChicken7,"Finally my Internet is back on, my friend has my phone so no Twitter or Facebook! I was going crazy! "
0,1677921853,Sat May 02 04:41:15 PDT 2009,NO_QUERY,MOODYLYNN,"Trying to get some sleep,working a night shift tonight,but neighbours have got the builders in  "
0,1677922122,Sat May 02 04:41:19 PDT 2009,NO_QUERY,aelmazaidi,@ZaireenAzman coolios! Its kinda weird spending my weekend alone without u n nafis  going out for dinner later with hampus!
0,1677922206,Sat May 02 04:41:21 PDT 2009,NO_QUERY,Pandrose,"what can I do, planning for leaving Paris almost done, it's just why I fall in love "
0,1677922242,Sat May 02 04:41:21 PDT 2009,NO_QUERY,Emiliadoll,5 awesome aussies isn't looking too great. Apparently our Wednesday is leaving as well as our Friday 
0,1677922383,Sat May 02 04:41:24 PDT 2009,NO_QUERY,Kamakazy,@muscati Nope  next time i pick a place to study i will make sure they have a branch...
0,1677922397,Sat May 02 04:41:24 PDT 2009,NO_QUERY,limbclock,"i just realised that even if there was a massive swine flu outbreak, i would still not be able to loot an Alko or a Supermarket "
0,1677922937,Sat May 02 04:41:33 PDT 2009,NO_QUERY,ShaunMichael80,"@rickirose19 I called you twice, you had me worried. But you didn't call back or text "
0,1677923044,Sat May 02 04:41:35 PDT 2009,NO_QUERY,kathrin2003,where can I watch JONAS!!?? ahhh... living in Austria is sometimes so NOT cool!!! 
0,1677923074,Sat May 02 04:41:35 PDT 2009,NO_QUERY,Cheekeebabe,The crows are dissapointing tonight! ggrrr...! not happy! 
0,1677923078,Sat May 02 04:41:36 PDT 2009,NO_QUERY,Bailey666,"having a lazy lazy day, when i should be working  back on with databases i guess, may be able to fit in some fallout hoperfully!"
0,1677923284,Sat May 02 04:41:39 PDT 2009,NO_QUERY,laughterland,"@zigpalmer Nothing wrong with mine, just helped my mum to get a new phone from them. The order still hasn't come through after 2 weeks "
0,1677923389,Sat May 02 04:41:41 PDT 2009,NO_QUERY,Joscene,my eyes are itching like hell 
0,1677923950,Sat May 02 04:41:50 PDT 2009,NO_QUERY,DeannaDoyle,@NancyODell Thanks! Looks like it's a rainy day at the Derby  Hope it clears up &amp; you have a great day! Everyone watch Nancy@4pm ET NBC!!
0,1677924056,Sat May 02 04:41:52 PDT 2009,NO_QUERY,youthanasia,missed that one... 
0,1677924355,Sat May 02 04:41:57 PDT 2009,NO_QUERY,elenarr,ohhhh myy gooodddd that was really bad. i can't play good anymore. i freakin failed the song! 
0,1677924740,Sat May 02 04:42:03 PDT 2009,NO_QUERY,whoisdjspecialk,Dissapointed in tha Bombers performance 
0,1677925020,Sat May 02 04:42:07 PDT 2009,NO_QUERY,sweetchichi77,@deucenj I don't get a good morning 
0,1677925029,Sat May 02 04:42:08 PDT 2009,NO_QUERY,Rodax,"Off for a run, then to help the bro-in-law move. "
0,1677925057,Sat May 02 04:42:08 PDT 2009,NO_QUERY,spaceboy_,@tokicat but i like my subjects  i dont know what else to do 
0,1677925160,Sat May 02 04:42:10 PDT 2009,NO_QUERY,Aahmeebee,I want to go home!!! 
0,1677925316,Sat May 02 04:42:13 PDT 2009,NO_QUERY,laughalotlucy,Rain  how very ordinary.
0,1677925426,Sat May 02 04:42:14 PDT 2009,NO_QUERY,Bruno108,@arancinibaby im pretty good..yesterday i went 2 the beach ;) and 2day so much work to catch up on! 
0,1677925684,Sat May 02 04:42:18 PDT 2009,NO_QUERY,jadoon88,I want I'm a PC stickers  #pc #microsoft
0,1677925824,Sat May 02 04:42:21 PDT 2009,NO_QUERY,fakebestfriend,Two am and I'm bored and sober. 
0,1677926459,Sat May 02 04:42:33 PDT 2009,NO_QUERY,iiacovou,@josianna  Yep.... still feeling rough!  and have so much to do! 
0,1677926515,Sat May 02 04:42:34 PDT 2009,NO_QUERY,Ouchy,Amazing day in London. HAve to go to a BBQ with rugby dicks.  I wish London was solely a geek town.
0,1677926599,Sat May 02 04:42:35 PDT 2009,NO_QUERY,MeggyJo,wages didn't even last 24 hours...uh oh 
0,1677926631,Sat May 02 04:42:36 PDT 2009,NO_QUERY,drelu,Strange my iPhone does not accept calls when I am online. 
0,1677929866,Sat May 02 04:43:33 PDT 2009,NO_QUERY,Smophs,Just finished my last pack of Nerds. Sad times 
0,1677930016,Sat May 02 04:43:36 PDT 2009,NO_QUERY,JGONeill,@RedMummy I can't decide whether to go to London next week or not - flu fears 
0,1677930284,Sat May 02 04:43:41 PDT 2009,NO_QUERY,rainbowdarling,"So, watched videos from the @jonathancoulton concert from last July in #CLE, finished my pogo badges...  good morinng! Now work. "
0,1677930442,Sat May 02 04:43:44 PDT 2009,NO_QUERY,els12,gonna have to start labelling my food so that dad doesn't eat it. thief 
0,1677930584,Sat May 02 04:43:47 PDT 2009,NO_QUERY,wikiwawa,Being dragged round the shops  need to get out on the bike!
0,1677931129,Sat May 02 04:43:57 PDT 2009,NO_QUERY,jackfaulkner,@Shinybiscuit  (I have no advice)
0,1677931583,Sat May 02 04:44:05 PDT 2009,NO_QUERY,hoyci,"Am not at A1 GP this weekend  hand Still damaged from bike crash. Still never mind new bike now gleaming after wash, big rideout monday"
0,1677931756,Sat May 02 04:44:08 PDT 2009,NO_QUERY,mywordsflyup,"Sorry for the use of language, but I'm really pissed off. "
0,1677932090,Sat May 02 04:44:15 PDT 2009,NO_QUERY,DaeDae11,Dentist  then a funfilled day with my babyyyyy!!
0,1677932297,Sat May 02 04:44:18 PDT 2009,NO_QUERY,laurenvharrison,just about to log on2 mymaths 
0,1677932895,Sat May 02 04:44:30 PDT 2009,NO_QUERY,anggieholics,i wish ben has twitter 
0,1677933025,Sat May 02 04:44:33 PDT 2009,NO_QUERY,Livin__Legend,@JoseOmar I'm ready to see all of you on stage! unforunately you will not come to my country  . c ya in Londonnnn!!!!
0,1677933456,Sat May 02 04:44:41 PDT 2009,NO_QUERY,mustntgrumble,Wondering how long to leave the cupboard contents out to ensure ants have departed.... making the kitchen look even messier than usual 
0,1677934099,Sat May 02 04:44:53 PDT 2009,NO_QUERY,islandFLAVOURED,@ClintonSparks  now every1s buyin ropes 4my 30th for a joke  the moral of the story is lol i thought turnin 30 was being really ancient
0,1677934857,Sat May 02 04:45:05 PDT 2009,NO_QUERY,DAMstar,"Off to the gym today I think, then round to a friends to watch the Hatton fight...due to start at 4am "
0,1677935084,Sat May 02 04:45:09 PDT 2009,NO_QUERY,chaordicjeff,Getting ready this morning for a tournament that is about to get rained out.  Sux...  From Jeff's Moto Q
0,1677935167,Sat May 02 04:45:10 PDT 2009,NO_QUERY,chidambaram_s,should play cricket today .. ... Almost after an year 
0,1677935356,Sat May 02 04:45:13 PDT 2009,NO_QUERY,Emily818,@Lozza237 aww sorry we are all out of bags  hah (yer i am happy)
0,1677935559,Sat May 02 04:45:17 PDT 2009,NO_QUERY,mlexiehayden,"Dreading the fact that I have to get up and mow the grass shortly  Taxes and Grass cutting, the ONLY two things I hate about houses"
0,1677935562,Sat May 02 04:45:17 PDT 2009,NO_QUERY,happyfairies,wrapped up in bed feelin so s0 so ILL! my energy levels lying on the floor dead somewhere 
0,1677935629,Sat May 02 04:45:18 PDT 2009,NO_QUERY,WendyRobb,anyone here suffer from migraines? ever felt one coming for two days before it hits? Think I have one looming 
0,1677935732,Sat May 02 04:45:20 PDT 2009,NO_QUERY,missyamyrose,All i can do right now is laugh. I should not be here right now i'm tired 
0,1677935922,Sat May 02 04:45:23 PDT 2009,NO_QUERY,PALISTER,Can't believe it's such a nice day and I have to work a 1-10  hopefully nobody wants to sit in the dark on day like this!!
0,1677935997,Sat May 02 04:45:25 PDT 2009,NO_QUERY,Danomnius,@LadyBlue88 guess i wont be taking mr S for a la tasca after all 
0,1677936107,Sat May 02 04:45:27 PDT 2009,NO_QUERY,joedalawd,not alloweed in town today  :'( muma me mums such a bitch
0,1677936278,Sat May 02 04:45:30 PDT 2009,NO_QUERY,randomflowers,snooker is the most evil sport ever  please jeebus let football be better to me!
0,1677936283,Sat May 02 04:45:30 PDT 2009,NO_QUERY,boardyuk,"Still waiting for the band to get here for the next session, things were meant to start around midday  Really wanna get these tracks done"
0,1677936381,Sat May 02 04:45:32 PDT 2009,NO_QUERY,JMSMITH_AvonRep,Hi ev1! Haven't &quot;twittered&quot; 4 like 2 weeks...comp problems  Anyway go 2 www.youravon.com/joysmith to get FREE GIFT offer ending tom. !!
0,1677936734,Sat May 02 04:45:38 PDT 2009,NO_QUERY,giuliagiga,is studying for d next one  xxxxxxx
0,1677936860,Sat May 02 04:45:40 PDT 2009,NO_QUERY,killerweasel,Blob cat scratched my finger last night and it hurts. 
0,1677937632,Sat May 02 04:45:54 PDT 2009,NO_QUERY,mushypea007,"My house was robbed last night   one car, cash, watch &amp; laptop stolen-ASSHOLES"
0,1677938349,Sat May 02 04:46:06 PDT 2009,NO_QUERY,KitchenKitty,Headache 
0,1677938419,Sat May 02 04:46:07 PDT 2009,NO_QUERY,jo1foster,"@checkers - ah, bummer, marina has been sick all week, so you may not see her tomorrow "
0,1677938465,Sat May 02 04:46:08 PDT 2009,NO_QUERY,LBOI,Sipping Banrock Station #Moscato .... I think I have developed a full-fledged flu. Dang it 
0,1677938970,Sat May 02 04:46:17 PDT 2009,NO_QUERY,mozzzzy,"Why does milo ventimiglia have to be so hot, and he doesn't even know i exist  haha"
0,1677938991,Sat May 02 04:46:17 PDT 2009,NO_QUERY,Reillywtfff,This is too early 
0,1677939037,Sat May 02 04:46:18 PDT 2009,NO_QUERY,ginader,@mikewest very jealous! I totally love white asparagus with Hollandaise but nobody sells the awesome white asparagus outside germany. Meh 
0,1677939480,Sat May 02 04:46:26 PDT 2009,NO_QUERY,Jae878,@Aussie_Nicole I dont  think they are live just yet.. Sat nite US time is the live show.. This might be one from a while back  
0,1677939519,Sat May 02 04:46:27 PDT 2009,NO_QUERY,Mitshellin,"@Beverleyknight How come it's taken ages?!! When U have it, cn u let me know how expensive the roaming charges r? Not a lot of wifi here "
0,1677939657,Sat May 02 04:46:29 PDT 2009,NO_QUERY,Music_Maiden,@VanessaMadge I know right  have A knot in my back and it's gone straight to my head...boo
0,1677939669,Sat May 02 04:46:29 PDT 2009,NO_QUERY,spaceboy_,@PaigeXc I have no money or companions 
0,1677939769,Sat May 02 04:46:31 PDT 2009,NO_QUERY,ilostthegame,Another loser: i just lost the game  http://tinyurl.com/cyeekq
0,1677939841,Sat May 02 04:46:32 PDT 2009,NO_QUERY,tthartsya,@lindalopez srry I never got back to u! 
0,1677940018,Sat May 02 04:46:35 PDT 2009,NO_QUERY,jmacmullin,"@gb96 don't bother, the crows are losing "
0,1677940021,Sat May 02 04:46:35 PDT 2009,NO_QUERY,mustntgrumble,"@christay0102 9, but with his difficulties, he is much more vulnerable physically &amp; emotionally "
0,1677940273,Sat May 02 04:46:40 PDT 2009,NO_QUERY,robotbatman,Now everyone is sleeping on my couches and floor   But I am not sleepy!  What to do?  Cats are restless.  Only 2 beer left.  Watch Bottom?
0,1677940301,Sat May 02 04:46:40 PDT 2009,NO_QUERY,caleighbenson,@MichyGeary Sorry. I was writing that email to Candace and got sidetracked with the time.  Forgive me?
0,1677940629,Sat May 02 04:46:46 PDT 2009,NO_QUERY,xxxmegzxxx,"@RosiieS8 heyya rosie, what you been upto? i cant go on the a2aa website to find out anymore  xx"
0,1677941052,Sat May 02 04:46:54 PDT 2009,NO_QUERY,evanforrester,I wish to be happy 
0,1677941254,Sat May 02 04:46:58 PDT 2009,NO_QUERY,CHRISSYuheard,damn i had something really knowledgable to say and ive forgotten it. damn hangovers 
0,1677941258,Sat May 02 04:46:58 PDT 2009,NO_QUERY,rabinshres,carryin weight of 13kg for nearly a km is tough job. ah! my hands 
0,1677941452,Sat May 02 04:47:01 PDT 2009,NO_QUERY,AramBarra,Had to give out his lucky 1us bill to pay a cab 
0,1677941527,Sat May 02 04:47:02 PDT 2009,NO_QUERY,htothastandish,@jondavis  no fair...i wanna go! 
0,1677941707,Sat May 02 04:47:05 PDT 2009,NO_QUERY,loopylou15,Gran has arrived. 
0,1677941866,Sat May 02 04:47:08 PDT 2009,NO_QUERY,LinziDrew,Hangover. 
0,1677942538,Sat May 02 04:47:20 PDT 2009,NO_QUERY,ChristalWasHere,Ace...still sick   dogs r cute until they get the runs&amp;get 2 vomitting (TMI?). .... Straight to the vet we go....
0,1677942567,Sat May 02 04:47:21 PDT 2009,NO_QUERY,Chocolishus,@twmozzi oh god my predictive text. 
0,1677942676,Sat May 02 04:47:23 PDT 2009,NO_QUERY,mynameislouie,Starving  and i need cigs !
0,1677942977,Sat May 02 04:47:28 PDT 2009,NO_QUERY,rnch,does anyone else have a bf/gf/husband/wife  who works WAYYYY to much?    
0,1677943039,Sat May 02 04:47:29 PDT 2009,NO_QUERY,ollekirchmeier,But Bob Hund starts to play at 21.00 and the party at strand starts at 22? 
0,1677943095,Sat May 02 04:47:30 PDT 2009,NO_QUERY,Melissaraad,@psi_borg totally agree! Living is so damn expensive!! 
0,1677943318,Sat May 02 04:47:35 PDT 2009,NO_QUERY,MsChristineDior,"so i lied, i cant sleep "
0,1677946634,Sat May 02 04:48:34 PDT 2009,NO_QUERY,Lobbcobb,@nicklangridge Yay! We are reunited! ....i can't upload a photo though 
0,1677947122,Sat May 02 04:48:43 PDT 2009,NO_QUERY,theycallmedree,taking the SAT. 
0,1677947228,Sat May 02 04:48:45 PDT 2009,NO_QUERY,RopeMarksMuse,I think the vet has bought a second house with my money 
0,1677947247,Sat May 02 04:48:45 PDT 2009,NO_QUERY,jwingram70,@zaibatsu would love to friend him stupid 5000 rule 
0,1677947646,Sat May 02 04:48:52 PDT 2009,NO_QUERY,khoaco,About to start chemistry homework 
0,1677947697,Sat May 02 04:48:53 PDT 2009,NO_QUERY,mjmaha,at work 
0,1677947863,Sat May 02 04:48:56 PDT 2009,NO_QUERY,aubz_000,feels like my hair is too dark to wear anything nice to work!!! 
0,1677947932,Sat May 02 04:48:58 PDT 2009,NO_QUERY,maryamalhamly,is exploring twitter - and partied too much last night!  Must get back to work!
0,1677948323,Sat May 02 04:49:05 PDT 2009,NO_QUERY,ohjennifer,@vickie_allport haha i know  you do too don't lie!!
0,1677948430,Sat May 02 04:49:07 PDT 2009,NO_QUERY,meimAsinglecell, dude I almost just shocked myself. Lesson learned never get outta the shower and think electricity won't hate on ur ass.
0,1677948493,Sat May 02 04:49:08 PDT 2009,NO_QUERY,gexxinknox,M's not feeling well... so we're probably not going out on our 'dventure today 
0,1677948668,Sat May 02 04:49:11 PDT 2009,NO_QUERY,NDUBZFAN4EVA,@_dappy_ bt it said in da papers she got it x 
0,1677948988,Sat May 02 04:49:17 PDT 2009,NO_QUERY,histapleface,"r.i.p pony, you ment alot to me. now ill have to get taxi's.  no more pony express for taylor. goodbye. xoxo"
0,1677949542,Sat May 02 04:49:26 PDT 2009,NO_QUERY,mirandapink,nothing 
0,1677949555,Sat May 02 04:49:26 PDT 2009,NO_QUERY,Claire93,@emilyos O my gosh. i hope it does 2! I bet it wont tho...  @taylorswift13 Please stay a while after your London show on THURSDAY. Please?
0,1677949646,Sat May 02 04:49:28 PDT 2009,NO_QUERY,ashleyyepsen,@lovealwayspaige ily. i'll do anything to make everything okay again. 
0,1677949849,Sat May 02 04:49:31 PDT 2009,NO_QUERY,amesbunny03,At work but still not feeling so hot. There are bagels beside me and they smell so good. But no appetite 
0,1677949855,Sat May 02 04:49:32 PDT 2009,NO_QUERY,Ashayo,"@xiaxian1 Agreed   On the bright side, I got fill in on an Ulduar raid and we got Flame Leviathan down. Fun fight!"
0,1677950119,Sat May 02 04:49:37 PDT 2009,NO_QUERY,JUULSS14,"@LizJonasHQ Are the magazine just going 2 B on sale in USA right? I'm from Spain  Whatever,thank you so much for everything you do on JHQ!"
0,1677950182,Sat May 02 04:49:38 PDT 2009,NO_QUERY,k8ex,in work! uh oh the sun is gone 
0,1677950878,Sat May 02 04:49:51 PDT 2009,NO_QUERY,kristinnsmith,Great so @mikesigner and @jodywagner will both be in Farmville this am and I cant see them 
0,1677951984,Sat May 02 04:50:09 PDT 2009,NO_QUERY,Lucozade_Rox,I Never Gt Paid  Im So Annoyed They Sed It Wud Go In This Weekend   No Muney For CRISPS :L &lt;3 =] x
0,1677951992,Sat May 02 04:50:09 PDT 2009,NO_QUERY,ftfaust,"Hey, just saw @espcrs on VBTV...saw last few seconds  Have to check back later to see the whole thing"
0,1677952392,Sat May 02 04:50:16 PDT 2009,NO_QUERY,Beckyrudd,"Watching the boro match, really hope the win  my laptops broken "
0,1677952829,Sat May 02 04:50:23 PDT 2009,NO_QUERY,lost_kafei,Why am I not hungry today? I've barely eaten anything ... Just when I thoughtI had put anorexia behind me 
0,1677952841,Sat May 02 04:50:23 PDT 2009,NO_QUERY,sudy4,Ugh gotta go to the stupid drill competition  dont wanna go Its to early. [CELTICS WIN]
0,1677952885,Sat May 02 04:50:24 PDT 2009,NO_QUERY,lyndspants,reallly super hungover  on my death bed.
0,1677953076,Sat May 02 04:50:28 PDT 2009,NO_QUERY,angelniki,"i think my blackberry has died   the battery keeps running out after i charge it, what will i do without my bb?"
0,1677953080,Sat May 02 04:50:28 PDT 2009,NO_QUERY,ririnyan,"@DigitalFur I'd love to go to a furmeet, but I'd be terrified due to my social phobia. I've never met another fur IRL. "
0,1677953256,Sat May 02 04:50:31 PDT 2009,NO_QUERY,tessadeleon,"bye, Chuck. "
0,1677953888,Sat May 02 04:50:42 PDT 2009,NO_QUERY,sweetseryn,"@levO11 I went and seen Wolverine....I got be honest, I wasn't all that impressed....I thought it was kinda slow/boring!  IMHO!  "
0,1677954049,Sat May 02 04:50:44 PDT 2009,NO_QUERY,McFlyer4ever,is really nervous 4 her audition  any suggestions?
0,1677954449,Sat May 02 04:50:52 PDT 2009,NO_QUERY,faiznurdavid,"@harleendavid I knowww!  haha yeah, I'm gonna miss my chocoholic "
0,1677954463,Sat May 02 04:50:52 PDT 2009,NO_QUERY,muhreenuh69,I wish i could go to warped and bamboozle tour. 
0,1677954792,Sat May 02 04:50:57 PDT 2009,NO_QUERY,soccergirlJaim,just woke up 
0,1677955143,Sat May 02 04:51:04 PDT 2009,NO_QUERY,itsabell,"I NEED CAFFEINE! still haven't managed to convince people starbucks would be a good idea, will have to make boring coffee at home instead "
0,1677955496,Sat May 02 04:51:10 PDT 2009,NO_QUERY,HDRidingRenee,3 days off and too much rain to go outside and play 
0,1677955851,Sat May 02 04:51:16 PDT 2009,NO_QUERY,wonderdonut15,@Rove1974 that's one more than my tigers  we'll see who's above who after 2moro Mr. Mcmanus!
0,1677955909,Sat May 02 04:51:17 PDT 2009,NO_QUERY,glitterandtwang,"@madstuart this is the conundrum. i may have to go back to semester 1 mode: print, print, print. poor trees! "
0,1677955995,Sat May 02 04:51:19 PDT 2009,NO_QUERY,PricelessToni,Overslept. Schedule is alllllll messed up now. 
0,1677956133,Sat May 02 04:51:21 PDT 2009,NO_QUERY,sakbaboy,"@DiiLee will thnx any way, I really love my BB but it hard to get some good app's "
0,1677957516,Sat May 02 04:51:44 PDT 2009,NO_QUERY,Intellagirl,I guess @typewriter will have to go take on @johnfcady without me 
0,1677957577,Sat May 02 04:51:45 PDT 2009,NO_QUERY,PurrrpleOrchid,Spending time in Nash with my hunnie before he leaves for Florida for a whole week. Really gunna miss him 
0,1677957638,Sat May 02 04:51:47 PDT 2009,NO_QUERY,ivileeispissed,You crazy 
0,1677957797,Sat May 02 04:51:49 PDT 2009,NO_QUERY,kathrynw73,is wanting to relax but gotta clean my house 
0,1677958370,Sat May 02 04:51:59 PDT 2009,NO_QUERY,cathylando,is torn between two choices 
0,1677958435,Sat May 02 04:52:01 PDT 2009,NO_QUERY,ithinkifarted,i shall sleep soon 
0,1677958506,Sat May 02 04:52:02 PDT 2009,NO_QUERY,AngeloSaysHi,I dont get twitter 
0,1677958520,Sat May 02 04:52:02 PDT 2009,NO_QUERY,juul666,"trying to find some Beyonce tickets for the show tonight, or tomorrow ( my sister is a huge fan). i miss my 'we're-on-a-break-boyfriend' "
0,1677958621,Sat May 02 04:52:03 PDT 2009,NO_QUERY,cwhozin,Had a nightmare. Can't go back to sleep now. 
0,1677958693,Sat May 02 04:52:04 PDT 2009,NO_QUERY,Beaniebella,Flights delayed..hair disasters..missing shoes! How can i convince non-corkonian mates that i simply MUST be in a bar for 3pm @ latest! 
0,1677958740,Sat May 02 04:52:05 PDT 2009,NO_QUERY,gina_v_1214,still don't have the time to twit..i dont think this is for me 
0,1677958804,Sat May 02 04:52:06 PDT 2009,NO_QUERY,_maisy,@lil_stephanie coz im sad  WHOS THE GUY YOU MIGHT FALL IN LOVE WITH? 
0,1677958806,Sat May 02 04:52:06 PDT 2009,NO_QUERY,steelerswinegir,On way to Harrisburg w/ the fam. Not happy about it. Darn Madre &amp; her guilt trips &amp; nagging 
0,1677958866,Sat May 02 04:52:07 PDT 2009,NO_QUERY,Dehara,Another lonely saturday night.. Yeaah 30 nights to go.. Come home baby.. I miss you 
0,1677959354,Sat May 02 04:52:15 PDT 2009,NO_QUERY,YourVA,"@peibossman I love PEI, we considered moving there 2 yrs ago; unfortunately hubby got a job offer in Toronto - PEI employer called 2 late "
0,1677959355,Sat May 02 04:52:15 PDT 2009,NO_QUERY,juliaarghh,"@TellYaFriday  I have nothing else to do...i'm so lame, Yes i am working tomorrow, night shift i dont want to work though.  you working?"
0,1677959698,Sat May 02 04:52:21 PDT 2009,NO_QUERY,chelkface,@Shell_face you saw milk!!!!  lucky bum! i want to see it NOW!
0,1677959843,Sat May 02 04:52:23 PDT 2009,NO_QUERY,cartoonmoney,Watching final Pushing Daisies.   *infinite+3 sadfaces*
0,1677959897,Sat May 02 04:52:24 PDT 2009,NO_QUERY,ivileeispissed,I love you too 
0,1677960078,Sat May 02 04:52:27 PDT 2009,NO_QUERY,Corkers88,"Another night coming home from work in tears. What to do, what to do.... "
0,1677960093,Sat May 02 04:52:27 PDT 2009,NO_QUERY,rahul_seo,"long weekend.....huh, no parties, no booze, no dinners, no outings..its just another week going to end "
0,1677960208,Sat May 02 04:52:29 PDT 2009,NO_QUERY,intelshwets,Umf  Yuvashakti is full on 14th May Manali trek. Will ha to wait till 24th :x
0,1677960547,Sat May 02 04:52:35 PDT 2009,NO_QUERY,anjum121,@hendrylee Hye then u should enjoy this rain coz in Dubai right now temp its 44cc too hot 
0,1677965931,Sat May 02 04:54:06 PDT 2009,NO_QUERY,phillygirl93,Cedar Cliff Relays 2day... Yay...but its gunna be rainy  lol wish me luck
0,1677966219,Sat May 02 04:54:10 PDT 2009,NO_QUERY,rachelzeitzen,Really busy morning at Deep Blue. Now off to repair a hot tub.  Resting tomorrow but back working again on Monday!! No bank hols for me 
0,1677966369,Sat May 02 04:54:13 PDT 2009,NO_QUERY,emmaroseyeahh,Virus on my bebo 
0,1677966498,Sat May 02 04:54:15 PDT 2009,NO_QUERY,kerrinjackson,no more cellphone.  uuuhg just keeps getting worse.
0,1677966597,Sat May 02 04:54:17 PDT 2009,NO_QUERY,SiSiMsGoGirl,Mornin twitz... ohmagwd this asthma is really killin me... it's never been this bad 
0,1677966863,Sat May 02 04:54:21 PDT 2009,NO_QUERY,eilidhteapot,am lonered           *sighs in self- pity*   anyone got any good free games websites?
0,1677967033,Sat May 02 04:54:24 PDT 2009,NO_QUERY,Bikhoy,Unfortunately it rained but allin all...Everyone enjoyed &amp; the food was great. I hope we could do it again b4 we leave. 
0,1677967044,Sat May 02 04:54:24 PDT 2009,NO_QUERY,eimonmyint,I live in Burma and today is the 1st year anniversary of the Nargis Cyclone. Bad memories. 
0,1677967173,Sat May 02 04:54:27 PDT 2009,NO_QUERY,katia_rio,just got back from my mothers store...i went to replace he for a while this morning... now i'm going to lunch...alone...  lol
0,1677967755,Sat May 02 04:54:36 PDT 2009,NO_QUERY,x_almost_easy_x,I've got a spot and its killing me! 
0,1677967829,Sat May 02 04:54:38 PDT 2009,NO_QUERY,drjude79,Twitter is still using my old username not my new one and I stiill can't change it back 
0,1677967830,Sat May 02 04:54:38 PDT 2009,NO_QUERY,rt0rres,I am starting to feel better buy my throat still hurts 
0,1677967953,Sat May 02 04:54:40 PDT 2009,NO_QUERY,pamsykes,Got it -- Touchstone House. Was a lovely old building  Pic here from new develpment going up across the rd: http://snipurl.com/h7n2t
0,1677968224,Sat May 02 04:54:45 PDT 2009,NO_QUERY,ErikKoliser,had some great sleep last night.  About to watch bedtime stories with family.  I wish i could go to State Bible Drill but parents in town 
0,1677968522,Sat May 02 04:54:50 PDT 2009,NO_QUERY,naghmehsamimi,its so cold outside.... not looking forward to winter 
0,1677968563,Sat May 02 04:54:51 PDT 2009,NO_QUERY,Jodelka,The smell of this hair mask is putting me right off my redbull 
0,1677968606,Sat May 02 04:54:51 PDT 2009,NO_QUERY,xelizabethjade,WOKE UP! but want to sleep in. AP TV SHOW review is on in an hour  im knackered
0,1677968609,Sat May 02 04:54:51 PDT 2009,NO_QUERY,aZzehSShezZa,Why won't some ppl reply back to me...so rude!!! 
0,1677968671,Sat May 02 04:54:53 PDT 2009,NO_QUERY,mobudaki,"@presurfer oh my god, that poor bird "
0,1677968750,Sat May 02 04:54:54 PDT 2009,NO_QUERY,andy_denton,"@LesPorter nope, no replies.  He uses twittterberry which isn't the easiest thing to keep up w/ replies.  But still... "
0,1677969316,Sat May 02 04:55:03 PDT 2009,NO_QUERY,lizzilovinmcfly,omg my annoying friends are coming with a 6 year old that is mad 
0,1677969490,Sat May 02 04:55:05 PDT 2009,NO_QUERY,jdbri,I went out and now I'm exhausted.  
0,1677969839,Sat May 02 04:55:10 PDT 2009,NO_QUERY,ShelbyCohen,My right nostril is burning and my throat still hurts. 
0,1677970049,Sat May 02 04:55:14 PDT 2009,NO_QUERY,Valerie3boys,I want katherine moenning back 
0,1677970275,Sat May 02 04:55:18 PDT 2009,NO_QUERY,Chad_Lad,"Havin a full on Cow Flap... cant find White Chicks dvd!  its either Elf, Finding Memo or Superbad...?"
0,1677970600,Sat May 02 04:55:23 PDT 2009,NO_QUERY,Keegs2610,I'm studyign for all three of my bloddy SACs nextweek 
0,1677970708,Sat May 02 04:55:25 PDT 2009,NO_QUERY,KatyDidsCards,Is anyone else having trouble with the items counters on Auctiva? I have been having probs since 4/22! Support is no help at all.  
0,1677970723,Sat May 02 04:55:25 PDT 2009,NO_QUERY,b0POP,SATs!!!  nervous as FACK!
0,1677971041,Sat May 02 04:55:31 PDT 2009,NO_QUERY,EarthToEmilee,ew. science homework  // cinema w/ Connie and Cara laterrr // YIPEE!
